18:25:04.919331 IP localhost.57152 > localhost.55555: Flags [S], seq 2589279098, win 65495, options [mss 65495,sackOK,TS val 2456345906 ecr 0,nop,wscale 7], length 0
18:25:04.919356 IP localhost.55555 > localhost.57152: Flags [S.], seq 3779138983, ack 2589279099, win 65483, options [mss 65495,sackOK,TS val 2456345906 ecr 2456345906,nop,wscale 7], length 0
18:25:04.919379 IP localhost.57152 > localhost.55555: Flags [.], ack 1, win 512, options [nop,nop,TS val 2456345906 ecr 2456345906], length 0
18:25:04.919442 IP localhost.57152 > localhost.55555: Flags [P.], seq 1:257, ack 1, win 512, options [nop,nop,TS val 2456345906 ecr 2456345906], length 256
18:25:04.919453 IP localhost.55555 > localhost.57152: Flags [.], ack 257, win 510, options [nop,nop,TS val 2456345906 ecr 2456345906], length 0
18:25:04.919471 IP localhost.57152 > localhost.55555: Flags [P.], seq 257:513, ack 1, win 512, options [nop,nop,TS val 2456345907 ecr 2456345906], length 256
18:25:04.919497 IP localhost.55555 > localhost.57152: Flags [.], ack 513, win 508, options [nop,nop,TS val 2456345907 ecr 2456345907], length 0
18:25:04.919511 IP localhost.57152 > localhost.55555: Flags [P.], seq 513:4609, ack 1, win 512, options [nop,nop,TS val 2456345907 ecr 2456345907], length 4096
18:25:04.966646 IP localhost.55555 > localhost.57152: Flags [.], ack 4609, win 476, options [nop,nop,TS val 2456345954 ecr 2456345907], length 0
18:25:04.966666 IP localhost.57152 > localhost.55555: Flags [P.], seq 4609:4865, ack 1, win 512, options [nop,nop,TS val 2456345954 ecr 2456345954], length 256
18:25:04.966674 IP localhost.55555 > localhost.57152: Flags [.], ack 4865, win 474, options [nop,nop,TS val 2456345954 ecr 2456345954], length 0
18:25:04.966679 IP localhost.57152 > localhost.55555: Flags [P.], seq 4865:5580, ack 1, win 512, options [nop,nop,TS val 2456345954 ecr 2456345954], length 715
18:25:04.966685 IP localhost.55555 > localhost.57152: Flags [.], ack 5580, win 469, options [nop,nop,TS val 2456345954 ecr 2456345954], length 0
18:25:04.966697 IP localhost.55555 > localhost.57152: Flags [P.], seq 1:80, ack 5580, win 469, options [nop,nop,TS val 2456345954 ecr 2456345954], length 79
18:25:04.966701 IP localhost.57152 > localhost.55555: Flags [.], ack 80, win 512, options [nop,nop,TS val 2456345954 ecr 2456345954], length 0
18:25:04.966706 IP localhost.57152 > localhost.55555: Flags [P.], seq 5580:5836, ack 80, win 512, options [nop,nop,TS val 2456345954 ecr 2456345954], length 256
18:25:05.014636 IP localhost.55555 > localhost.57152: Flags [.], ack 5836, win 467, options [nop,nop,TS val 2456346002 ecr 2456345954], length 0
18:25:05.014655 IP localhost.57152 > localhost.55555: Flags [P.], seq 5836:11159, ack 80, win 512, options [nop,nop,TS val 2456346002 ecr 2456346002], length 5323
18:25:05.014666 IP localhost.55555 > localhost.57152: Flags [P.], seq 80:159, ack 11159, win 426, options [nop,nop,TS val 2456346002 ecr 2456346002], length 79
18:25:05.014676 IP localhost.57152 > localhost.55555: Flags [P.], seq 11159:11415, ack 159, win 512, options [nop,nop,TS val 2456346002 ecr 2456346002], length 256
18:25:05.058626 IP localhost.55555 > localhost.57152: Flags [.], ack 11415, win 424, options [nop,nop,TS val 2456346046 ecr 2456346002], length 0
18:25:05.058633 IP localhost.57152 > localhost.55555: Flags [P.], seq 11415:16738, ack 159, win 512, options [nop,nop,TS val 2456346046 ecr 2456346046], length 5323
18:25:05.058655 IP localhost.55555 > localhost.57152: Flags [P.], seq 159:238, ack 16738, win 383, options [nop,nop,TS val 2456346046 ecr 2456346046], length 79
18:25:05.058663 IP localhost.57152 > localhost.55555: Flags [P.], seq 16738:16994, ack 238, win 512, options [nop,nop,TS val 2456346046 ecr 2456346046], length 256
18:25:05.102626 IP localhost.55555 > localhost.57152: Flags [.], ack 16994, win 381, options [nop,nop,TS val 2456346090 ecr 2456346046], length 0
18:25:05.102640 IP localhost.57152 > localhost.55555: Flags [P.], seq 16994:22317, ack 238, win 512, options [nop,nop,TS val 2456346090 ecr 2456346090], length 5323
18:25:05.102655 IP localhost.55555 > localhost.57152: Flags [P.], seq 238:317, ack 22317, win 340, options [nop,nop,TS val 2456346090 ecr 2456346090], length 79
18:25:05.102662 IP localhost.57152 > localhost.55555: Flags [P.], seq 22317:22573, ack 317, win 512, options [nop,nop,TS val 2456346090 ecr 2456346090], length 256
18:25:05.146626 IP localhost.55555 > localhost.57152: Flags [.], ack 22573, win 338, options [nop,nop,TS val 2456346134 ecr 2456346090], length 0
18:25:05.146633 IP localhost.57152 > localhost.55555: Flags [P.], seq 22573:27896, ack 317, win 512, options [nop,nop,TS val 2456346134 ecr 2456346134], length 5323
18:25:05.146648 IP localhost.55555 > localhost.57152: Flags [P.], seq 317:396, ack 27896, win 297, options [nop,nop,TS val 2456346134 ecr 2456346134], length 79
18:25:05.146663 IP localhost.57152 > localhost.55555: Flags [P.], seq 27896:28152, ack 396, win 512, options [nop,nop,TS val 2456346134 ecr 2456346134], length 256
18:25:05.190626 IP localhost.55555 > localhost.57152: Flags [.], ack 28152, win 295, options [nop,nop,TS val 2456346178 ecr 2456346134], length 0
18:25:05.190634 IP localhost.57152 > localhost.55555: Flags [P.], seq 28152:33475, ack 396, win 512, options [nop,nop,TS val 2456346178 ecr 2456346178], length 5323
18:25:05.190648 IP localhost.55555 > localhost.57152: Flags [P.], seq 396:475, ack 33475, win 254, options [nop,nop,TS val 2456346178 ecr 2456346178], length 79
18:25:05.190656 IP localhost.57152 > localhost.55555: Flags [P.], seq 33475:33731, ack 475, win 512, options [nop,nop,TS val 2456346178 ecr 2456346178], length 256
18:25:05.238625 IP localhost.55555 > localhost.57152: Flags [.], ack 33731, win 252, options [nop,nop,TS val 2456346226 ecr 2456346178], length 0
18:25:05.238638 IP localhost.57152 > localhost.55555: Flags [P.], seq 33731:39054, ack 475, win 512, options [nop,nop,TS val 2456346226 ecr 2456346226], length 5323
18:25:05.238645 IP localhost.55555 > localhost.57152: Flags [P.], seq 475:554, ack 39054, win 211, options [nop,nop,TS val 2456346226 ecr 2456346226], length 79
18:25:05.238660 IP localhost.57152 > localhost.55555: Flags [P.], seq 39054:39310, ack 554, win 512, options [nop,nop,TS val 2456346226 ecr 2456346226], length 256
18:25:05.282625 IP localhost.55555 > localhost.57152: Flags [.], ack 39310, win 209, options [nop,nop,TS val 2456346270 ecr 2456346226], length 0
18:25:05.282631 IP localhost.57152 > localhost.55555: Flags [P.], seq 39310:44633, ack 554, win 512, options [nop,nop,TS val 2456346270 ecr 2456346270], length 5323
18:25:05.282645 IP localhost.55555 > localhost.57152: Flags [P.], seq 554:633, ack 44633, win 168, options [nop,nop,TS val 2456346270 ecr 2456346270], length 79
18:25:05.282652 IP localhost.57152 > localhost.55555: Flags [P.], seq 44633:44889, ack 633, win 512, options [nop,nop,TS val 2456346270 ecr 2456346270], length 256
18:25:05.330625 IP localhost.55555 > localhost.57152: Flags [.], ack 44889, win 166, options [nop,nop,TS val 2456346318 ecr 2456346270], length 0
18:25:05.330631 IP localhost.57152 > localhost.55555: Flags [P.], seq 44889:50212, ack 633, win 512, options [nop,nop,TS val 2456346318 ecr 2456346318], length 5323
18:25:05.330638 IP localhost.55555 > localhost.57152: Flags [P.], seq 633:712, ack 50212, win 125, options [nop,nop,TS val 2456346318 ecr 2456346318], length 79
18:25:05.330653 IP localhost.57152 > localhost.55555: Flags [P.], seq 50212:50468, ack 712, win 512, options [nop,nop,TS val 2456346318 ecr 2456346318], length 256
18:25:05.374624 IP localhost.55555 > localhost.57152: Flags [.], ack 50468, win 123, options [nop,nop,TS val 2456346362 ecr 2456346318], length 0
18:25:05.374630 IP localhost.57152 > localhost.55555: Flags [P.], seq 50468:55791, ack 712, win 512, options [nop,nop,TS val 2456346362 ecr 2456346362], length 5323
18:25:05.374645 IP localhost.55555 > localhost.57152: Flags [P.], seq 712:791, ack 55791, win 82, options [nop,nop,TS val 2456346362 ecr 2456346362], length 79
18:25:05.374659 IP localhost.57152 > localhost.55555: Flags [P.], seq 55791:56047, ack 791, win 512, options [nop,nop,TS val 2456346362 ecr 2456346362], length 256
18:25:05.418632 IP localhost.55555 > localhost.57152: Flags [.], ack 56047, win 80, options [nop,nop,TS val 2456346406 ecr 2456346362], length 0
18:25:05.418637 IP localhost.57152 > localhost.55555: Flags [P.], seq 56047:61370, ack 791, win 512, options [nop,nop,TS val 2456346406 ecr 2456346406], length 5323
18:25:05.418644 IP localhost.55555 > localhost.57152: Flags [P.], seq 791:870, ack 61370, win 39, options [nop,nop,TS val 2456346406 ecr 2456346406], length 79
18:25:05.418651 IP localhost.57152 > localhost.55555: Flags [P.], seq 61370:61626, ack 870, win 512, options [nop,nop,TS val 2456346406 ecr 2456346406], length 256
18:25:05.466625 IP localhost.55555 > localhost.57152: Flags [.], ack 61626, win 37, options [nop,nop,TS val 2456346454 ecr 2456346406], length 0
18:25:05.698632 IP localhost.57152 > localhost.55555: Flags [P.], seq 61626:66362, ack 870, win 512, options [nop,nop,TS val 2456346686 ecr 2456346454], length 4736
18:25:05.698641 IP localhost.55555 > localhost.57152: Flags [.], ack 66362, win 0, options [nop,nop,TS val 2456346686 ecr 2456346686], length 0
18:25:05.698649 IP localhost.55555 > localhost.57152: Flags [.], ack 66362, win 9, options [nop,nop,TS val 2456346686 ecr 2456346686], length 0
18:25:05.698653 IP localhost.57152 > localhost.55555: Flags [P.], seq 66362:66949, ack 870, win 512, options [nop,nop,TS val 2456346686 ecr 2456346686], length 587
18:25:05.698659 IP localhost.55555 > localhost.57152: Flags [.], ack 66949, win 9, options [nop,nop,TS val 2456346686 ecr 2456346686], length 0
18:25:05.698666 IP localhost.55555 > localhost.57152: Flags [P.], seq 870:949, ack 66949, win 9, options [nop,nop,TS val 2456346686 ecr 2456346686], length 79
18:25:05.698674 IP localhost.57152 > localhost.55555: Flags [P.], seq 66949:67205, ack 949, win 512, options [nop,nop,TS val 2456346686 ecr 2456346686], length 256
18:25:05.742625 IP localhost.55555 > localhost.57152: Flags [.], ack 67205, win 9, options [nop,nop,TS val 2456346730 ecr 2456346686], length 0
18:25:05.970646 IP localhost.57152 > localhost.55555: Flags [P.], seq 67205:68357, ack 949, win 512, options [nop,nop,TS val 2456346958 ecr 2456346730], length 1152
18:25:05.970662 IP localhost.55555 > localhost.57152: Flags [.], ack 68357, win 0, options [nop,nop,TS val 2456346958 ecr 2456346958], length 0
18:25:05.970678 IP localhost.55555 > localhost.57152: Flags [.], ack 68357, win 9, options [nop,nop,TS val 2456346958 ecr 2456346958], length 0
18:25:06.194635 IP localhost.57152 > localhost.55555: Flags [P.], seq 68357:69509, ack 949, win 512, options [nop,nop,TS val 2456347182 ecr 2456346958], length 1152
18:25:06.194658 IP localhost.55555 > localhost.57152: Flags [.], ack 69509, win 0, options [nop,nop,TS val 2456347182 ecr 2456347182], length 0
18:25:06.194663 IP localhost.55555 > localhost.57152: Flags [.], ack 69509, win 9, options [nop,nop,TS val 2456347182 ecr 2456347182], length 0
18:25:06.422629 IP localhost.57152 > localhost.55555: Flags [P.], seq 69509:70661, ack 949, win 512, options [nop,nop,TS val 2456347410 ecr 2456347182], length 1152
18:25:06.422643 IP localhost.55555 > localhost.57152: Flags [.], ack 70661, win 0, options [nop,nop,TS val 2456347410 ecr 2456347410], length 0
18:25:06.422654 IP localhost.55555 > localhost.57152: Flags [.], ack 70661, win 9, options [nop,nop,TS val 2456347410 ecr 2456347410], length 0
18:25:06.642646 IP localhost.57152 > localhost.55555: Flags [P.], seq 70661:71813, ack 949, win 512, options [nop,nop,TS val 2456347630 ecr 2456347410], length 1152
18:25:06.642656 IP localhost.55555 > localhost.57152: Flags [.], ack 71813, win 0, options [nop,nop,TS val 2456347630 ecr 2456347630], length 0
18:25:06.642667 IP localhost.55555 > localhost.57152: Flags [.], ack 71813, win 9, options [nop,nop,TS val 2456347630 ecr 2456347630], length 0
18:25:06.642673 IP localhost.57152 > localhost.55555: Flags [P.], seq 71813:72528, ack 949, win 512, options [nop,nop,TS val 2456347630 ecr 2456347630], length 715
18:25:06.642679 IP localhost.55555 > localhost.57152: Flags [.], ack 72528, win 9, options [nop,nop,TS val 2456347630 ecr 2456347630], length 0
18:25:06.642687 IP localhost.55555 > localhost.57152: Flags [P.], seq 949:1028, ack 72528, win 9, options [nop,nop,TS val 2456347630 ecr 2456347630], length 79
18:25:06.642694 IP localhost.57152 > localhost.55555: Flags [P.], seq 72528:72784, ack 1028, win 512, options [nop,nop,TS val 2456347630 ecr 2456347630], length 256
18:25:06.686631 IP localhost.55555 > localhost.57152: Flags [.], ack 72784, win 9, options [nop,nop,TS val 2456347674 ecr 2456347630], length 0
18:25:06.906636 IP localhost.57152 > localhost.55555: Flags [P.], seq 72784:73936, ack 1028, win 512, options [nop,nop,TS val 2456347894 ecr 2456347674], length 1152
18:25:06.906652 IP localhost.55555 > localhost.57152: Flags [.], ack 73936, win 0, options [nop,nop,TS val 2456347894 ecr 2456347894], length 0
18:25:06.906667 IP localhost.55555 > localhost.57152: Flags [.], ack 73936, win 9, options [nop,nop,TS val 2456347894 ecr 2456347894], length 0
18:25:07.126632 IP localhost.57152 > localhost.55555: Flags [P.], seq 73936:75088, ack 1028, win 512, options [nop,nop,TS val 2456348114 ecr 2456347894], length 1152
18:25:07.126647 IP localhost.55555 > localhost.57152: Flags [.], ack 75088, win 0, options [nop,nop,TS val 2456348114 ecr 2456348114], length 0
18:25:07.126655 IP localhost.55555 > localhost.57152: Flags [.], ack 75088, win 9, options [nop,nop,TS val 2456348114 ecr 2456348114], length 0
18:25:07.342650 IP localhost.57152 > localhost.55555: Flags [P.], seq 75088:76240, ack 1028, win 512, options [nop,nop,TS val 2456348330 ecr 2456348114], length 1152
18:25:07.342668 IP localhost.55555 > localhost.57152: Flags [.], ack 76240, win 0, options [nop,nop,TS val 2456348330 ecr 2456348330], length 0
18:25:07.342677 IP localhost.55555 > localhost.57152: Flags [.], ack 76240, win 9, options [nop,nop,TS val 2456348330 ecr 2456348330], length 0
18:25:07.558639 IP localhost.57152 > localhost.55555: Flags [P.], seq 76240:77392, ack 1028, win 512, options [nop,nop,TS val 2456348546 ecr 2456348330], length 1152
18:25:07.558649 IP localhost.55555 > localhost.57152: Flags [.], ack 77392, win 0, options [nop,nop,TS val 2456348546 ecr 2456348546], length 0
18:25:07.558655 IP localhost.55555 > localhost.57152: Flags [.], ack 77392, win 9, options [nop,nop,TS val 2456348546 ecr 2456348546], length 0
18:25:07.558663 IP localhost.57152 > localhost.55555: Flags [P.], seq 77392:78107, ack 1028, win 512, options [nop,nop,TS val 2456348546 ecr 2456348546], length 715
18:25:07.558676 IP localhost.55555 > localhost.57152: Flags [.], ack 78107, win 9, options [nop,nop,TS val 2456348546 ecr 2456348546], length 0
18:25:07.558683 IP localhost.55555 > localhost.57152: Flags [P.], seq 1028:1107, ack 78107, win 9, options [nop,nop,TS val 2456348546 ecr 2456348546], length 79
18:25:07.558692 IP localhost.57152 > localhost.55555: Flags [P.], seq 78107:78363, ack 1107, win 512, options [nop,nop,TS val 2456348546 ecr 2456348546], length 256
18:25:07.606632 IP localhost.55555 > localhost.57152: Flags [.], ack 78363, win 9, options [nop,nop,TS val 2456348594 ecr 2456348546], length 0
18:25:07.826641 IP localhost.57152 > localhost.55555: Flags [P.], seq 78363:79515, ack 1107, win 512, options [nop,nop,TS val 2456348814 ecr 2456348594], length 1152
18:25:07.826659 IP localhost.55555 > localhost.57152: Flags [.], ack 79515, win 0, options [nop,nop,TS val 2456348814 ecr 2456348814], length 0
18:25:07.826664 IP localhost.55555 > localhost.57152: Flags [.], ack 79515, win 9, options [nop,nop,TS val 2456348814 ecr 2456348814], length 0
18:25:08.042645 IP localhost.57152 > localhost.55555: Flags [P.], seq 79515:80667, ack 1107, win 512, options [nop,nop,TS val 2456349030 ecr 2456348814], length 1152
18:25:08.042663 IP localhost.55555 > localhost.57152: Flags [.], ack 80667, win 0, options [nop,nop,TS val 2456349030 ecr 2456349030], length 0
18:25:08.042672 IP localhost.55555 > localhost.57152: Flags [.], ack 80667, win 9, options [nop,nop,TS val 2456349030 ecr 2456349030], length 0
18:25:08.258645 IP localhost.57152 > localhost.55555: Flags [P.], seq 80667:81819, ack 1107, win 512, options [nop,nop,TS val 2456349246 ecr 2456349030], length 1152
18:25:08.258656 IP localhost.55555 > localhost.57152: Flags [.], ack 81819, win 0, options [nop,nop,TS val 2456349246 ecr 2456349246], length 0
18:25:08.258666 IP localhost.55555 > localhost.57152: Flags [.], ack 81819, win 9, options [nop,nop,TS val 2456349246 ecr 2456349246], length 0
18:25:08.474644 IP localhost.57152 > localhost.55555: Flags [P.], seq 81819:82971, ack 1107, win 512, options [nop,nop,TS val 2456349462 ecr 2456349246], length 1152
18:25:08.474669 IP localhost.55555 > localhost.57152: Flags [.], ack 82971, win 0, options [nop,nop,TS val 2456349462 ecr 2456349462], length 0
18:25:08.474679 IP localhost.55555 > localhost.57152: Flags [.], ack 82971, win 9, options [nop,nop,TS val 2456349462 ecr 2456349462], length 0
18:25:08.474686 IP localhost.57152 > localhost.55555: Flags [P.], seq 82971:83686, ack 1107, win 512, options [nop,nop,TS val 2456349462 ecr 2456349462], length 715
18:25:08.474701 IP localhost.55555 > localhost.57152: Flags [.], ack 83686, win 9, options [nop,nop,TS val 2456349462 ecr 2456349462], length 0
18:25:08.474711 IP localhost.55555 > localhost.57152: Flags [P.], seq 1107:1186, ack 83686, win 9, options [nop,nop,TS val 2456349462 ecr 2456349462], length 79
18:25:08.474720 IP localhost.57152 > localhost.55555: Flags [P.], seq 83686:83942, ack 1186, win 512, options [nop,nop,TS val 2456349462 ecr 2456349462], length 256
18:25:08.518632 IP localhost.55555 > localhost.57152: Flags [.], ack 83942, win 9, options [nop,nop,TS val 2456349506 ecr 2456349462], length 0
18:25:08.734639 IP localhost.57152 > localhost.55555: Flags [P.], seq 83942:85094, ack 1186, win 512, options [nop,nop,TS val 2456349722 ecr 2456349506], length 1152
18:25:08.734656 IP localhost.55555 > localhost.57152: Flags [.], ack 85094, win 0, options [nop,nop,TS val 2456349722 ecr 2456349722], length 0
18:25:08.734665 IP localhost.55555 > localhost.57152: Flags [.], ack 85094, win 9, options [nop,nop,TS val 2456349722 ecr 2456349722], length 0
18:25:08.950640 IP localhost.57152 > localhost.55555: Flags [P.], seq 85094:86246, ack 1186, win 512, options [nop,nop,TS val 2456349938 ecr 2456349722], length 1152
18:25:08.950647 IP localhost.55555 > localhost.57152: Flags [.], ack 86246, win 0, options [nop,nop,TS val 2456349938 ecr 2456349938], length 0
18:25:08.950664 IP localhost.55555 > localhost.57152: Flags [.], ack 86246, win 9, options [nop,nop,TS val 2456349938 ecr 2456349938], length 0
18:25:09.166636 IP localhost.57152 > localhost.55555: Flags [P.], seq 86246:87398, ack 1186, win 512, options [nop,nop,TS val 2456350154 ecr 2456349938], length 1152
18:25:09.166652 IP localhost.55555 > localhost.57152: Flags [.], ack 87398, win 0, options [nop,nop,TS val 2456350154 ecr 2456350154], length 0
18:25:09.166661 IP localhost.55555 > localhost.57152: Flags [.], ack 87398, win 9, options [nop,nop,TS val 2456350154 ecr 2456350154], length 0
18:25:09.378628 IP localhost.57152 > localhost.55555: Flags [P.], seq 87398:88550, ack 1186, win 512, options [nop,nop,TS val 2456350366 ecr 2456350154], length 1152
18:25:09.378633 IP localhost.55555 > localhost.57152: Flags [.], ack 88550, win 0, options [nop,nop,TS val 2456350366 ecr 2456350366], length 0
18:25:09.378637 IP localhost.55555 > localhost.57152: Flags [.], ack 88550, win 9, options [nop,nop,TS val 2456350366 ecr 2456350366], length 0
18:25:09.378649 IP localhost.57152 > localhost.55555: Flags [P.], seq 88550:89265, ack 1186, win 512, options [nop,nop,TS val 2456350366 ecr 2456350366], length 715
18:25:09.378662 IP localhost.55555 > localhost.57152: Flags [.], ack 89265, win 9, options [nop,nop,TS val 2456350366 ecr 2456350366], length 0
18:25:09.378677 IP localhost.55555 > localhost.57152: Flags [P.], seq 1186:1265, ack 89265, win 9, options [nop,nop,TS val 2456350366 ecr 2456350366], length 79
18:25:09.378687 IP localhost.57152 > localhost.55555: Flags [P.], seq 89265:89521, ack 1265, win 512, options [nop,nop,TS val 2456350366 ecr 2456350366], length 256
18:25:09.422632 IP localhost.55555 > localhost.57152: Flags [.], ack 89521, win 9, options [nop,nop,TS val 2456350410 ecr 2456350366], length 0
18:25:09.638626 IP localhost.57152 > localhost.55555: Flags [P.], seq 89521:90673, ack 1265, win 512, options [nop,nop,TS val 2456350626 ecr 2456350410], length 1152
18:25:09.638631 IP localhost.55555 > localhost.57152: Flags [.], ack 90673, win 0, options [nop,nop,TS val 2456350626 ecr 2456350626], length 0
18:25:09.638637 IP localhost.55555 > localhost.57152: Flags [.], ack 90673, win 9, options [nop,nop,TS val 2456350626 ecr 2456350626], length 0
18:25:09.854631 IP localhost.57152 > localhost.55555: Flags [P.], seq 90673:91825, ack 1265, win 512, options [nop,nop,TS val 2456350842 ecr 2456350626], length 1152
18:25:09.854636 IP localhost.55555 > localhost.57152: Flags [.], ack 91825, win 0, options [nop,nop,TS val 2456350842 ecr 2456350842], length 0
18:25:09.854643 IP localhost.55555 > localhost.57152: Flags [.], ack 91825, win 9, options [nop,nop,TS val 2456350842 ecr 2456350842], length 0
18:25:10.070632 IP localhost.57152 > localhost.55555: Flags [P.], seq 91825:92977, ack 1265, win 512, options [nop,nop,TS val 2456351058 ecr 2456350842], length 1152
18:25:10.070653 IP localhost.55555 > localhost.57152: Flags [.], ack 92977, win 0, options [nop,nop,TS val 2456351058 ecr 2456351058], length 0
18:25:10.070660 IP localhost.55555 > localhost.57152: Flags [.], ack 92977, win 9, options [nop,nop,TS val 2456351058 ecr 2456351058], length 0
18:25:10.282656 IP localhost.57152 > localhost.55555: Flags [P.], seq 92977:94129, ack 1265, win 512, options [nop,nop,TS val 2456351270 ecr 2456351058], length 1152
18:25:10.282666 IP localhost.55555 > localhost.57152: Flags [.], ack 94129, win 0, options [nop,nop,TS val 2456351270 ecr 2456351270], length 0
18:25:10.282674 IP localhost.55555 > localhost.57152: Flags [.], ack 94129, win 9, options [nop,nop,TS val 2456351270 ecr 2456351270], length 0
18:25:10.282680 IP localhost.57152 > localhost.55555: Flags [P.], seq 94129:94844, ack 1265, win 512, options [nop,nop,TS val 2456351270 ecr 2456351270], length 715
18:25:10.282685 IP localhost.55555 > localhost.57152: Flags [.], ack 94844, win 9, options [nop,nop,TS val 2456351270 ecr 2456351270], length 0
18:25:10.282695 IP localhost.55555 > localhost.57152: Flags [P.], seq 1265:1344, ack 94844, win 9, options [nop,nop,TS val 2456351270 ecr 2456351270], length 79
18:25:10.282703 IP localhost.57152 > localhost.55555: Flags [P.], seq 94844:95100, ack 1344, win 512, options [nop,nop,TS val 2456351270 ecr 2456351270], length 256
18:25:10.326633 IP localhost.55555 > localhost.57152: Flags [.], ack 95100, win 9, options [nop,nop,TS val 2456351314 ecr 2456351270], length 0
18:25:10.542632 IP localhost.57152 > localhost.55555: Flags [P.], seq 95100:96252, ack 1344, win 512, options [nop,nop,TS val 2456351530 ecr 2456351314], length 1152
18:25:10.542639 IP localhost.55555 > localhost.57152: Flags [.], ack 96252, win 0, options [nop,nop,TS val 2456351530 ecr 2456351530], length 0
18:25:10.542652 IP localhost.55555 > localhost.57152: Flags [.], ack 96252, win 9, options [nop,nop,TS val 2456351530 ecr 2456351530], length 0
18:25:10.758635 IP localhost.57152 > localhost.55555: Flags [P.], seq 96252:97404, ack 1344, win 512, options [nop,nop,TS val 2456351746 ecr 2456351530], length 1152
18:25:10.758640 IP localhost.55555 > localhost.57152: Flags [.], ack 97404, win 0, options [nop,nop,TS val 2456351746 ecr 2456351746], length 0
18:25:10.758643 IP localhost.55555 > localhost.57152: Flags [.], ack 97404, win 9, options [nop,nop,TS val 2456351746 ecr 2456351746], length 0
18:25:10.974644 IP localhost.57152 > localhost.55555: Flags [P.], seq 97404:98556, ack 1344, win 512, options [nop,nop,TS val 2456351962 ecr 2456351746], length 1152
18:25:10.974653 IP localhost.55555 > localhost.57152: Flags [.], ack 98556, win 0, options [nop,nop,TS val 2456351962 ecr 2456351962], length 0
18:25:10.974658 IP localhost.55555 > localhost.57152: Flags [.], ack 98556, win 9, options [nop,nop,TS val 2456351962 ecr 2456351962], length 0
18:25:11.186632 IP localhost.57152 > localhost.55555: Flags [P.], seq 98556:99708, ack 1344, win 512, options [nop,nop,TS val 2456352174 ecr 2456351962], length 1152
18:25:11.186639 IP localhost.55555 > localhost.57152: Flags [.], ack 99708, win 0, options [nop,nop,TS val 2456352174 ecr 2456352174], length 0
18:25:11.186658 IP localhost.55555 > localhost.57152: Flags [.], ack 99708, win 9, options [nop,nop,TS val 2456352174 ecr 2456352174], length 0
18:25:11.186664 IP localhost.57152 > localhost.55555: Flags [P.], seq 99708:100423, ack 1344, win 512, options [nop,nop,TS val 2456352174 ecr 2456352174], length 715
18:25:11.186671 IP localhost.55555 > localhost.57152: Flags [.], ack 100423, win 9, options [nop,nop,TS val 2456352174 ecr 2456352174], length 0
18:25:11.186686 IP localhost.55555 > localhost.57152: Flags [P.], seq 1344:1423, ack 100423, win 9, options [nop,nop,TS val 2456352174 ecr 2456352174], length 79
18:25:11.186693 IP localhost.57152 > localhost.55555: Flags [P.], seq 100423:100679, ack 1423, win 512, options [nop,nop,TS val 2456352174 ecr 2456352174], length 256
18:25:11.230626 IP localhost.55555 > localhost.57152: Flags [.], ack 100679, win 9, options [nop,nop,TS val 2456352218 ecr 2456352174], length 0
18:25:11.446647 IP localhost.57152 > localhost.55555: Flags [P.], seq 100679:101831, ack 1423, win 512, options [nop,nop,TS val 2456352434 ecr 2456352218], length 1152
18:25:11.446665 IP localhost.55555 > localhost.57152: Flags [.], ack 101831, win 0, options [nop,nop,TS val 2456352434 ecr 2456352434], length 0
18:25:11.446673 IP localhost.55555 > localhost.57152: Flags [.], ack 101831, win 9, options [nop,nop,TS val 2456352434 ecr 2456352434], length 0
18:25:11.662631 IP localhost.57152 > localhost.55555: Flags [P.], seq 101831:102983, ack 1423, win 512, options [nop,nop,TS val 2456352650 ecr 2456352434], length 1152
18:25:11.662637 IP localhost.55555 > localhost.57152: Flags [.], ack 102983, win 0, options [nop,nop,TS val 2456352650 ecr 2456352650], length 0
18:25:11.662646 IP localhost.55555 > localhost.57152: Flags [.], ack 102983, win 9, options [nop,nop,TS val 2456352650 ecr 2456352650], length 0
18:25:11.874654 IP localhost.57152 > localhost.55555: Flags [P.], seq 102983:104135, ack 1423, win 512, options [nop,nop,TS val 2456352862 ecr 2456352650], length 1152
18:25:11.874665 IP localhost.55555 > localhost.57152: Flags [.], ack 104135, win 0, options [nop,nop,TS val 2456352862 ecr 2456352862], length 0
18:25:11.874682 IP localhost.55555 > localhost.57152: Flags [.], ack 104135, win 9, options [nop,nop,TS val 2456352862 ecr 2456352862], length 0
18:25:12.086636 IP localhost.57152 > localhost.55555: Flags [P.], seq 104135:105287, ack 1423, win 512, options [nop,nop,TS val 2456353074 ecr 2456352862], length 1152
18:25:12.086645 IP localhost.55555 > localhost.57152: Flags [.], ack 105287, win 0, options [nop,nop,TS val 2456353074 ecr 2456353074], length 0
18:25:12.086655 IP localhost.55555 > localhost.57152: Flags [.], ack 105287, win 9, options [nop,nop,TS val 2456353074 ecr 2456353074], length 0
18:25:12.086659 IP localhost.57152 > localhost.55555: Flags [P.], seq 105287:106002, ack 1423, win 512, options [nop,nop,TS val 2456353074 ecr 2456353074], length 715
18:25:12.086665 IP localhost.55555 > localhost.57152: Flags [.], ack 106002, win 9, options [nop,nop,TS val 2456353074 ecr 2456353074], length 0
18:25:12.086675 IP localhost.55555 > localhost.57152: Flags [P.], seq 1423:1502, ack 106002, win 9, options [nop,nop,TS val 2456353074 ecr 2456353074], length 79
18:25:12.086685 IP localhost.57152 > localhost.55555: Flags [P.], seq 106002:106258, ack 1502, win 512, options [nop,nop,TS val 2456353074 ecr 2456353074], length 256
18:25:12.130625 IP localhost.55555 > localhost.57152: Flags [.], ack 106258, win 9, options [nop,nop,TS val 2456353118 ecr 2456353074], length 0
18:25:12.346630 IP localhost.57152 > localhost.55555: Flags [P.], seq 106258:107410, ack 1502, win 512, options [nop,nop,TS val 2456353334 ecr 2456353118], length 1152
18:25:12.346636 IP localhost.55555 > localhost.57152: Flags [.], ack 107410, win 0, options [nop,nop,TS val 2456353334 ecr 2456353334], length 0
18:25:12.346642 IP localhost.55555 > localhost.57152: Flags [.], ack 107410, win 9, options [nop,nop,TS val 2456353334 ecr 2456353334], length 0
18:25:12.562635 IP localhost.57152 > localhost.55555: Flags [P.], seq 107410:108562, ack 1502, win 512, options [nop,nop,TS val 2456353550 ecr 2456353334], length 1152
18:25:12.562657 IP localhost.55555 > localhost.57152: Flags [.], ack 108562, win 0, options [nop,nop,TS val 2456353550 ecr 2456353550], length 0
18:25:12.562664 IP localhost.55555 > localhost.57152: Flags [.], ack 108562, win 9, options [nop,nop,TS val 2456353550 ecr 2456353550], length 0
18:25:12.774630 IP localhost.57152 > localhost.55555: Flags [P.], seq 108562:109714, ack 1502, win 512, options [nop,nop,TS val 2456353762 ecr 2456353550], length 1152
18:25:12.774643 IP localhost.55555 > localhost.57152: Flags [.], ack 109714, win 0, options [nop,nop,TS val 2456353762 ecr 2456353762], length 0
18:25:12.774648 IP localhost.55555 > localhost.57152: Flags [.], ack 109714, win 9, options [nop,nop,TS val 2456353762 ecr 2456353762], length 0
18:25:12.986631 IP localhost.57152 > localhost.55555: Flags [P.], seq 109714:110866, ack 1502, win 512, options [nop,nop,TS val 2456353974 ecr 2456353762], length 1152
18:25:12.986641 IP localhost.55555 > localhost.57152: Flags [.], ack 110866, win 0, options [nop,nop,TS val 2456353974 ecr 2456353974], length 0
18:25:12.986649 IP localhost.55555 > localhost.57152: Flags [.], ack 110866, win 9, options [nop,nop,TS val 2456353974 ecr 2456353974], length 0
18:25:12.986653 IP localhost.57152 > localhost.55555: Flags [P.], seq 110866:111581, ack 1502, win 512, options [nop,nop,TS val 2456353974 ecr 2456353974], length 715
18:25:12.986673 IP localhost.55555 > localhost.57152: Flags [.], ack 111581, win 9, options [nop,nop,TS val 2456353974 ecr 2456353974], length 0
18:25:12.986680 IP localhost.55555 > localhost.57152: Flags [P.], seq 1502:1581, ack 111581, win 9, options [nop,nop,TS val 2456353974 ecr 2456353974], length 79
18:25:12.986690 IP localhost.57152 > localhost.55555: Flags [P.], seq 111581:111837, ack 1581, win 512, options [nop,nop,TS val 2456353974 ecr 2456353974], length 256
18:25:13.030631 IP localhost.55555 > localhost.57152: Flags [.], ack 111837, win 9, options [nop,nop,TS val 2456354018 ecr 2456353974], length 0
18:25:13.246631 IP localhost.57152 > localhost.55555: Flags [P.], seq 111837:112989, ack 1581, win 512, options [nop,nop,TS val 2456354234 ecr 2456354018], length 1152
18:25:13.246652 IP localhost.55555 > localhost.57152: Flags [.], ack 112989, win 0, options [nop,nop,TS val 2456354234 ecr 2456354234], length 0
18:25:13.246659 IP localhost.55555 > localhost.57152: Flags [.], ack 112989, win 9, options [nop,nop,TS val 2456354234 ecr 2456354234], length 0
18:25:13.462647 IP localhost.57152 > localhost.55555: Flags [P.], seq 112989:114141, ack 1581, win 512, options [nop,nop,TS val 2456354450 ecr 2456354234], length 1152
18:25:13.462657 IP localhost.55555 > localhost.57152: Flags [.], ack 114141, win 0, options [nop,nop,TS val 2456354450 ecr 2456354450], length 0
18:25:13.462666 IP localhost.55555 > localhost.57152: Flags [.], ack 114141, win 9, options [nop,nop,TS val 2456354450 ecr 2456354450], length 0
18:25:13.674633 IP localhost.57152 > localhost.55555: Flags [P.], seq 114141:115293, ack 1581, win 512, options [nop,nop,TS val 2456354662 ecr 2456354450], length 1152
18:25:13.674640 IP localhost.55555 > localhost.57152: Flags [.], ack 115293, win 0, options [nop,nop,TS val 2456354662 ecr 2456354662], length 0
18:25:13.674655 IP localhost.55555 > localhost.57152: Flags [.], ack 115293, win 9, options [nop,nop,TS val 2456354662 ecr 2456354662], length 0
18:25:13.886644 IP localhost.57152 > localhost.55555: Flags [P.], seq 115293:116445, ack 1581, win 512, options [nop,nop,TS val 2456354874 ecr 2456354662], length 1152
18:25:13.886659 IP localhost.55555 > localhost.57152: Flags [.], ack 116445, win 0, options [nop,nop,TS val 2456354874 ecr 2456354874], length 0
18:25:13.886667 IP localhost.55555 > localhost.57152: Flags [.], ack 116445, win 9, options [nop,nop,TS val 2456354874 ecr 2456354874], length 0
18:25:13.886671 IP localhost.57152 > localhost.55555: Flags [P.], seq 116445:117160, ack 1581, win 512, options [nop,nop,TS val 2456354874 ecr 2456354874], length 715
18:25:13.886677 IP localhost.55555 > localhost.57152: Flags [.], ack 117160, win 9, options [nop,nop,TS val 2456354874 ecr 2456354874], length 0
18:25:13.886686 IP localhost.55555 > localhost.57152: Flags [P.], seq 1581:1660, ack 117160, win 9, options [nop,nop,TS val 2456354874 ecr 2456354874], length 79
18:25:13.886695 IP localhost.57152 > localhost.55555: Flags [P.], seq 117160:117416, ack 1660, win 512, options [nop,nop,TS val 2456354874 ecr 2456354874], length 256
18:25:13.930626 IP localhost.55555 > localhost.57152: Flags [.], ack 117416, win 9, options [nop,nop,TS val 2456354918 ecr 2456354874], length 0
18:25:14.146630 IP localhost.57152 > localhost.55555: Flags [P.], seq 117416:118568, ack 1660, win 512, options [nop,nop,TS val 2456355134 ecr 2456354918], length 1152
18:25:14.146636 IP localhost.55555 > localhost.57152: Flags [.], ack 118568, win 0, options [nop,nop,TS val 2456355134 ecr 2456355134], length 0
18:25:14.146651 IP localhost.55555 > localhost.57152: Flags [.], ack 118568, win 9, options [nop,nop,TS val 2456355134 ecr 2456355134], length 0
18:25:14.362630 IP localhost.57152 > localhost.55555: Flags [P.], seq 118568:119720, ack 1660, win 512, options [nop,nop,TS val 2456355350 ecr 2456355134], length 1152
18:25:14.362636 IP localhost.55555 > localhost.57152: Flags [.], ack 119720, win 0, options [nop,nop,TS val 2456355350 ecr 2456355350], length 0
18:25:14.362650 IP localhost.55555 > localhost.57152: Flags [.], ack 119720, win 9, options [nop,nop,TS val 2456355350 ecr 2456355350], length 0
18:25:14.574638 IP localhost.57152 > localhost.55555: Flags [P.], seq 119720:120872, ack 1660, win 512, options [nop,nop,TS val 2456355562 ecr 2456355350], length 1152
18:25:14.574648 IP localhost.55555 > localhost.57152: Flags [.], ack 120872, win 0, options [nop,nop,TS val 2456355562 ecr 2456355562], length 0
18:25:14.574657 IP localhost.55555 > localhost.57152: Flags [.], ack 120872, win 9, options [nop,nop,TS val 2456355562 ecr 2456355562], length 0
18:25:14.786631 IP localhost.57152 > localhost.55555: Flags [P.], seq 120872:122024, ack 1660, win 512, options [nop,nop,TS val 2456355774 ecr 2456355562], length 1152
18:25:14.786637 IP localhost.55555 > localhost.57152: Flags [.], ack 122024, win 0, options [nop,nop,TS val 2456355774 ecr 2456355774], length 0
18:25:14.786649 IP localhost.55555 > localhost.57152: Flags [.], ack 122024, win 9, options [nop,nop,TS val 2456355774 ecr 2456355774], length 0
18:25:14.786653 IP localhost.57152 > localhost.55555: Flags [P.], seq 122024:122739, ack 1660, win 512, options [nop,nop,TS val 2456355774 ecr 2456355774], length 715
18:25:14.786659 IP localhost.55555 > localhost.57152: Flags [.], ack 122739, win 9, options [nop,nop,TS val 2456355774 ecr 2456355774], length 0
18:25:14.786665 IP localhost.55555 > localhost.57152: Flags [P.], seq 1660:1739, ack 122739, win 9, options [nop,nop,TS val 2456355774 ecr 2456355774], length 79
18:25:14.786675 IP localhost.57152 > localhost.55555: Flags [P.], seq 122739:122995, ack 1739, win 512, options [nop,nop,TS val 2456355774 ecr 2456355774], length 256
18:25:14.830627 IP localhost.55555 > localhost.57152: Flags [.], ack 122995, win 9, options [nop,nop,TS val 2456355818 ecr 2456355774], length 0
18:25:15.050636 IP localhost.57152 > localhost.55555: Flags [P.], seq 122995:124147, ack 1739, win 512, options [nop,nop,TS val 2456356038 ecr 2456355818], length 1152
18:25:15.050645 IP localhost.55555 > localhost.57152: Flags [.], ack 124147, win 0, options [nop,nop,TS val 2456356038 ecr 2456356038], length 0
18:25:15.050650 IP localhost.55555 > localhost.57152: Flags [.], ack 124147, win 9, options [nop,nop,TS val 2456356038 ecr 2456356038], length 0
18:25:15.266646 IP localhost.57152 > localhost.55555: Flags [P.], seq 124147:125299, ack 1739, win 512, options [nop,nop,TS val 2456356254 ecr 2456356038], length 1152
18:25:15.266664 IP localhost.55555 > localhost.57152: Flags [.], ack 125299, win 0, options [nop,nop,TS val 2456356254 ecr 2456356254], length 0
18:25:15.266669 IP localhost.55555 > localhost.57152: Flags [.], ack 125299, win 9, options [nop,nop,TS val 2456356254 ecr 2456356254], length 0
18:25:15.482658 IP localhost.57152 > localhost.55555: Flags [P.], seq 125299:126451, ack 1739, win 512, options [nop,nop,TS val 2456356470 ecr 2456356254], length 1152
18:25:15.482669 IP localhost.55555 > localhost.57152: Flags [.], ack 126451, win 0, options [nop,nop,TS val 2456356470 ecr 2456356470], length 0
18:25:15.482674 IP localhost.55555 > localhost.57152: Flags [.], ack 126451, win 9, options [nop,nop,TS val 2456356470 ecr 2456356470], length 0
18:25:15.694638 IP localhost.57152 > localhost.55555: Flags [P.], seq 126451:127603, ack 1739, win 512, options [nop,nop,TS val 2456356682 ecr 2456356470], length 1152
18:25:15.694654 IP localhost.55555 > localhost.57152: Flags [.], ack 127603, win 0, options [nop,nop,TS val 2456356682 ecr 2456356682], length 0
18:25:15.694659 IP localhost.55555 > localhost.57152: Flags [.], ack 127603, win 9, options [nop,nop,TS val 2456356682 ecr 2456356682], length 0
18:25:15.694665 IP localhost.57152 > localhost.55555: Flags [P.], seq 127603:128318, ack 1739, win 512, options [nop,nop,TS val 2456356682 ecr 2456356682], length 715
18:25:15.694672 IP localhost.55555 > localhost.57152: Flags [.], ack 128318, win 9, options [nop,nop,TS val 2456356682 ecr 2456356682], length 0
18:25:15.694681 IP localhost.55555 > localhost.57152: Flags [P.], seq 1739:1818, ack 128318, win 9, options [nop,nop,TS val 2456356682 ecr 2456356682], length 79
18:25:15.694688 IP localhost.57152 > localhost.55555: Flags [P.], seq 128318:128574, ack 1818, win 512, options [nop,nop,TS val 2456356682 ecr 2456356682], length 256
18:25:15.738632 IP localhost.55555 > localhost.57152: Flags [.], ack 128574, win 9, options [nop,nop,TS val 2456356726 ecr 2456356682], length 0
18:25:15.954646 IP localhost.57152 > localhost.55555: Flags [P.], seq 128574:129726, ack 1818, win 512, options [nop,nop,TS val 2456356942 ecr 2456356726], length 1152
18:25:15.954655 IP localhost.55555 > localhost.57152: Flags [.], ack 129726, win 0, options [nop,nop,TS val 2456356942 ecr 2456356942], length 0
18:25:15.954664 IP localhost.55555 > localhost.57152: Flags [.], ack 129726, win 9, options [nop,nop,TS val 2456356942 ecr 2456356942], length 0
18:25:16.170634 IP localhost.57152 > localhost.55555: Flags [P.], seq 129726:130878, ack 1818, win 512, options [nop,nop,TS val 2456357158 ecr 2456356942], length 1152
18:25:16.170642 IP localhost.55555 > localhost.57152: Flags [.], ack 130878, win 0, options [nop,nop,TS val 2456357158 ecr 2456357158], length 0
18:25:16.170650 IP localhost.55555 > localhost.57152: Flags [.], ack 130878, win 9, options [nop,nop,TS val 2456357158 ecr 2456357158], length 0
18:25:16.382635 IP localhost.57152 > localhost.55555: Flags [P.], seq 130878:132030, ack 1818, win 512, options [nop,nop,TS val 2456357370 ecr 2456357158], length 1152
