16:15:11.285549 IP localhost.48862 > localhost.55555: Flags [S], seq 3075532577, win 65495, options [mss 65495,sackOK,TS val 539159659 ecr 0,nop,wscale 7], length 0
16:15:11.285567 IP localhost.55555 > localhost.48862: Flags [S.], seq 2722182856, ack 3075532578, win 65483, options [mss 65495,sackOK,TS val 539159659 ecr 539159659,nop,wscale 7], length 0
16:15:11.285580 IP localhost.48862 > localhost.55555: Flags [.], ack 1, win 512, options [nop,nop,TS val 539159659 ecr 539159659], length 0
16:15:11.285666 IP localhost.48862 > localhost.55555: Flags [P.], seq 1:257, ack 1, win 512, options [nop,nop,TS val 539159659 ecr 539159659], length 256
16:15:11.285671 IP localhost.55555 > localhost.48862: Flags [.], ack 257, win 510, options [nop,nop,TS val 539159659 ecr 539159659], length 0
16:15:11.285701 IP localhost.48862 > localhost.55555: Flags [P.], seq 257:513, ack 1, win 512, options [nop,nop,TS val 539159659 ecr 539159659], length 256
16:15:11.285713 IP localhost.55555 > localhost.48862: Flags [.], ack 513, win 508, options [nop,nop,TS val 539159659 ecr 539159659], length 0
16:15:11.285726 IP localhost.48862 > localhost.55555: Flags [P.], seq 513:769, ack 1, win 512, options [nop,nop,TS val 539159659 ecr 539159659], length 256
16:15:11.285729 IP localhost.55555 > localhost.48862: Flags [.], ack 769, win 506, options [nop,nop,TS val 539159659 ecr 539159659], length 0
16:15:11.285750 IP localhost.48862 > localhost.55555: Flags [P.], seq 769:1025, ack 1, win 512, options [nop,nop,TS val 539159659 ecr 539159659], length 256
16:15:11.285753 IP localhost.55555 > localhost.48862: Flags [.], ack 1025, win 504, options [nop,nop,TS val 539159659 ecr 539159659], length 0
16:15:11.285780 IP localhost.48862 > localhost.55555: Flags [P.], seq 1025:1281, ack 1, win 512, options [nop,nop,TS val 539159659 ecr 539159659], length 256
16:15:11.285784 IP localhost.55555 > localhost.48862: Flags [.], ack 1281, win 502, options [nop,nop,TS val 539159659 ecr 539159659], length 0
16:15:11.285804 IP localhost.48862 > localhost.55555: Flags [P.], seq 1281:1537, ack 1, win 512, options [nop,nop,TS val 539159659 ecr 539159659], length 256
16:15:11.285807 IP localhost.55555 > localhost.48862: Flags [.], ack 1537, win 501, options [nop,nop,TS val 539159659 ecr 539159659], length 0
16:15:11.285820 IP localhost.48862 > localhost.55555: Flags [P.], seq 1537:1793, ack 1, win 512, options [nop,nop,TS val 539159659 ecr 539159659], length 256
16:15:11.285825 IP localhost.55555 > localhost.48862: Flags [.], ack 1793, win 500, options [nop,nop,TS val 539159659 ecr 539159659], length 0
16:15:11.285838 IP localhost.48862 > localhost.55555: Flags [P.], seq 1793:2049, ack 1, win 512, options [nop,nop,TS val 539159659 ecr 539159659], length 256
16:15:11.285841 IP localhost.55555 > localhost.48862: Flags [.], ack 2049, win 499, options [nop,nop,TS val 539159659 ecr 539159659], length 0
16:15:11.285854 IP localhost.48862 > localhost.55555: Flags [P.], seq 2049:2305, ack 1, win 512, options [nop,nop,TS val 539159659 ecr 539159659], length 256
16:15:11.285857 IP localhost.55555 > localhost.48862: Flags [.], ack 2305, win 498, options [nop,nop,TS val 539159659 ecr 539159659], length 0
16:15:11.285870 IP localhost.48862 > localhost.55555: Flags [P.], seq 2305:2561, ack 1, win 512, options [nop,nop,TS val 539159659 ecr 539159659], length 256
16:15:11.285874 IP localhost.55555 > localhost.48862: Flags [.], ack 2561, win 497, options [nop,nop,TS val 539159659 ecr 539159659], length 0
16:15:11.285887 IP localhost.48862 > localhost.55555: Flags [P.], seq 2561:2817, ack 1, win 512, options [nop,nop,TS val 539159659 ecr 539159659], length 256
16:15:11.285890 IP localhost.55555 > localhost.48862: Flags [.], ack 2817, win 496, options [nop,nop,TS val 539159659 ecr 539159659], length 0
16:15:11.285903 IP localhost.48862 > localhost.55555: Flags [P.], seq 2817:3073, ack 1, win 512, options [nop,nop,TS val 539159659 ecr 539159659], length 256
16:15:11.285907 IP localhost.55555 > localhost.48862: Flags [.], ack 3073, win 495, options [nop,nop,TS val 539159659 ecr 539159659], length 0
16:15:11.285919 IP localhost.48862 > localhost.55555: Flags [P.], seq 3073:3329, ack 1, win 512, options [nop,nop,TS val 539159659 ecr 539159659], length 256
16:15:11.285923 IP localhost.55555 > localhost.48862: Flags [.], ack 3329, win 494, options [nop,nop,TS val 539159659 ecr 539159659], length 0
16:15:11.285936 IP localhost.48862 > localhost.55555: Flags [P.], seq 3329:3585, ack 1, win 512, options [nop,nop,TS val 539159659 ecr 539159659], length 256
16:15:11.285939 IP localhost.55555 > localhost.48862: Flags [.], ack 3585, win 493, options [nop,nop,TS val 539159659 ecr 539159659], length 0
16:15:11.285952 IP localhost.48862 > localhost.55555: Flags [P.], seq 3585:3841, ack 1, win 512, options [nop,nop,TS val 539159659 ecr 539159659], length 256
16:15:11.285955 IP localhost.55555 > localhost.48862: Flags [.], ack 3841, win 492, options [nop,nop,TS val 539159659 ecr 539159659], length 0
16:15:11.285969 IP localhost.48862 > localhost.55555: Flags [P.], seq 3841:4097, ack 1, win 512, options [nop,nop,TS val 539159659 ecr 539159659], length 256
16:15:11.285972 IP localhost.55555 > localhost.48862: Flags [.], ack 4097, win 491, options [nop,nop,TS val 539159659 ecr 539159659], length 0
16:15:11.285985 IP localhost.48862 > localhost.55555: Flags [P.], seq 4097:4353, ack 1, win 512, options [nop,nop,TS val 539159659 ecr 539159659], length 256
16:15:11.286830 IP localhost.48862 > localhost.55555: Flags [.], seq 4353:37094, ack 1, win 512, options [nop,nop,TS val 539159660 ecr 539159659], length 32741
16:15:11.287075 IP localhost.55555 > localhost.48862: Flags [.], ack 37094, win 234, options [nop,nop,TS val 539159660 ecr 539159659], length 0
16:15:11.287085 IP localhost.48862 > localhost.55555: Flags [P.], seq 37094:37350, ack 1, win 512, options [nop,nop,TS val 539159660 ecr 539159660], length 256
16:15:11.287120 IP localhost.55555 > localhost.48862: Flags [P.], seq 1:1025, ack 37350, win 232, options [nop,nop,TS val 539159660 ecr 539159660], length 1024
16:15:11.287126 IP localhost.48862 > localhost.55555: Flags [P.], seq 37350:38630, ack 1025, win 504, options [nop,nop,TS val 539159660 ecr 539159660], length 1280
16:15:11.287142 IP localhost.55555 > localhost.48862: Flags [P.], seq 1025:2049, ack 37350, win 232, options [nop,nop,TS val 539159660 ecr 539159660], length 1024
16:15:11.287372 IP localhost.55555 > localhost.48862: Flags [P.], seq 2049:34817, ack 37350, win 232, options [nop,nop,TS val 539159661 ecr 539159660], length 32768
16:15:11.302056 IP localhost.55555 > localhost.48862: Flags [P.], seq 2049:34817, ack 37350, win 232, options [nop,nop,TS val 539159674 ecr 539159660], length 32768
16:15:11.328643 IP localhost.48862 > localhost.55555: Flags [.], ack 2049, win 496, options [nop,nop,TS val 539159702 ecr 539159660], length 0
16:15:11.496637 IP localhost.48862 > localhost.55555: Flags [P.], seq 37350:38630, ack 2049, win 496, options [nop,nop,TS val 539159870 ecr 539159660], length 1280
16:15:11.548649 IP localhost.55555 > localhost.48862: Flags [P.], seq 2049:34817, ack 37350, win 232, options [nop,nop,TS val 539159922 ecr 539159870], length 32768
16:15:11.708638 IP localhost.48862 > localhost.55555: Flags [P.], seq 37350:38630, ack 2049, win 496, options [nop,nop,TS val 539160082 ecr 539159922], length 1280
16:15:11.988647 IP localhost.55555 > localhost.48862: Flags [P.], seq 2049:34817, ack 37350, win 232, options [nop,nop,TS val 539160362 ecr 539160082], length 32768
16:15:12.148630 IP localhost.48862 > localhost.55555: Flags [P.], seq 37350:38630, ack 2049, win 496, options [nop,nop,TS val 539160522 ecr 539160362], length 1280
16:15:12.852651 IP localhost.55555 > localhost.48862: Flags [P.], seq 2049:34817, ack 37350, win 232, options [nop,nop,TS val 539161226 ecr 539160522], length 32768
16:15:12.980635 IP localhost.48862 > localhost.55555: Flags [P.], seq 37350:38630, ack 2049, win 496, options [nop,nop,TS val 539161354 ecr 539161226], length 1280
16:15:14.548663 IP localhost.55555 > localhost.48862: Flags [P.], seq 2049:34817, ack 37350, win 232, options [nop,nop,TS val 539162922 ecr 539161354], length 32768
16:15:14.644627 IP localhost.48862 > localhost.55555: Flags [P.], seq 37350:38630, ack 2049, win 496, options [nop,nop,TS val 539163018 ecr 539162922], length 1280
16:15:18.100662 IP localhost.55555 > localhost.48862: Flags [P.], seq 2049:34817, ack 37350, win 232, options [nop,nop,TS val 539166474 ecr 539163018], length 32768
16:15:18.100668 IP localhost.48862 > localhost.55555: Flags [P.], seq 37350:38630, ack 2049, win 496, options [nop,nop,TS val 539166474 ecr 539162922], length 1280
16:15:24.756649 IP localhost.48862 > localhost.55555: Flags [P.], seq 37350:38630, ack 2049, win 496, options [nop,nop,TS val 539173130 ecr 539166474], length 1280
16:15:25.012656 IP localhost.55555 > localhost.48862: Flags [P.], seq 2049:34817, ack 37350, win 232, options [nop,nop,TS val 539173386 ecr 539173130], length 32768
16:15:38.068657 IP localhost.48862 > localhost.55555: Flags [P.], seq 37350:38630, ack 2049, win 496, options [nop,nop,TS val 539186442 ecr 539173386], length 1280
16:15:38.580662 IP localhost.55555 > localhost.48862: Flags [P.], seq 2049:34817, ack 37350, win 232, options [nop,nop,TS val 539186954 ecr 539186442], length 32768
16:16:04.692666 IP localhost.48862 > localhost.55555: Flags [P.], seq 37350:38630, ack 2049, win 496, options [nop,nop,TS val 539213066 ecr 539186954], length 1280
16:16:06.744672 IP localhost.55555 > localhost.48862: Flags [P.], seq 2049:34817, ack 37350, win 232, options [nop,nop,TS val 539215118 ecr 539213066], length 32768

