15:55:38.651222 IP localhost.48860 > localhost.55555: Flags [S], seq 1749503340, win 65495, options [mss 65495,sackOK,TS val 537987025 ecr 0,nop,wscale 7], length 0
15:55:38.651239 IP localhost.55555 > localhost.48860: Flags [S.], seq 259006941, ack 1749503341, win 65483, options [mss 65495,sackOK,TS val 537987025 ecr 537987025,nop,wscale 7], length 0
15:55:38.651252 IP localhost.48860 > localhost.55555: Flags [.], ack 1, win 512, options [nop,nop,TS val 537987025 ecr 537987025], length 0
15:55:38.651325 IP localhost.48860 > localhost.55555: Flags [P.], seq 1:5580, ack 1, win 512, options [nop,nop,TS val 537987025 ecr 537987025], length 5579
15:55:38.651330 IP localhost.55555 > localhost.48860: Flags [.], ack 5580, win 468, options [nop,nop,TS val 537987025 ecr 537987025], length 0
15:55:38.651374 IP localhost.55555 > localhost.48860: Flags [P.], seq 1:80, ack 5580, win 468, options [nop,nop,TS val 537987025 ecr 537987025], length 79
15:55:38.651380 IP localhost.48860 > localhost.55555: Flags [.], ack 80, win 512, options [nop,nop,TS val 537987025 ecr 537987025], length 0
15:55:38.651392 IP localhost.48860 > localhost.55555: Flags [P.], seq 5580:11159, ack 80, win 512, options [nop,nop,TS val 537987025 ecr 537987025], length 5579
15:55:38.651426 IP localhost.55555 > localhost.48860: Flags [P.], seq 80:159, ack 11159, win 425, options [nop,nop,TS val 537987025 ecr 537987025], length 79
15:55:38.651433 IP localhost.48860 > localhost.55555: Flags [.], ack 159, win 512, options [nop,nop,TS val 537987025 ecr 537987025], length 0
15:55:38.651449 IP localhost.48860 > localhost.55555: Flags [P.], seq 11159:16738, ack 159, win 512, options [nop,nop,TS val 537987025 ecr 537987025], length 5579
15:55:38.651476 IP localhost.55555 > localhost.48860: Flags [P.], seq 159:238, ack 16738, win 382, options [nop,nop,TS val 537987025 ecr 537987025], length 79
15:55:38.651482 IP localhost.48860 > localhost.55555: Flags [.], ack 238, win 512, options [nop,nop,TS val 537987025 ecr 537987025], length 0
15:55:38.651497 IP localhost.48860 > localhost.55555: Flags [P.], seq 16738:22317, ack 238, win 512, options [nop,nop,TS val 537987025 ecr 537987025], length 5579
15:55:38.651524 IP localhost.55555 > localhost.48860: Flags [P.], seq 238:317, ack 22317, win 339, options [nop,nop,TS val 537987025 ecr 537987025], length 79
15:55:38.651529 IP localhost.48860 > localhost.55555: Flags [.], ack 317, win 512, options [nop,nop,TS val 537987025 ecr 537987025], length 0
15:55:38.651544 IP localhost.48860 > localhost.55555: Flags [P.], seq 22317:27896, ack 317, win 512, options [nop,nop,TS val 537987025 ecr 537987025], length 5579
15:55:38.651576 IP localhost.55555 > localhost.48860: Flags [P.], seq 317:396, ack 27896, win 296, options [nop,nop,TS val 537987025 ecr 537987025], length 79
15:55:38.651582 IP localhost.48860 > localhost.55555: Flags [.], ack 396, win 512, options [nop,nop,TS val 537987025 ecr 537987025], length 0
15:55:38.651597 IP localhost.48860 > localhost.55555: Flags [P.], seq 27896:33475, ack 396, win 512, options [nop,nop,TS val 537987025 ecr 537987025], length 5579
15:55:38.651624 IP localhost.55555 > localhost.48860: Flags [P.], seq 396:475, ack 33475, win 253, options [nop,nop,TS val 537987025 ecr 537987025], length 79
15:55:38.651630 IP localhost.48860 > localhost.55555: Flags [.], ack 475, win 512, options [nop,nop,TS val 537987025 ecr 537987025], length 0
15:55:38.651644 IP localhost.48860 > localhost.55555: Flags [P.], seq 33475:39054, ack 475, win 512, options [nop,nop,TS val 537987025 ecr 537987025], length 5579
15:55:38.651671 IP localhost.55555 > localhost.48860: Flags [P.], seq 475:554, ack 39054, win 210, options [nop,nop,TS val 537987025 ecr 537987025], length 79
15:55:38.651677 IP localhost.48860 > localhost.55555: Flags [.], ack 554, win 512, options [nop,nop,TS val 537987025 ecr 537987025], length 0
15:55:38.651692 IP localhost.48860 > localhost.55555: Flags [P.], seq 39054:44633, ack 554, win 512, options [nop,nop,TS val 537987025 ecr 537987025], length 5579
15:55:38.651721 IP localhost.55555 > localhost.48860: Flags [P.], seq 554:633, ack 44633, win 167, options [nop,nop,TS val 537987025 ecr 537987025], length 79
15:55:38.651727 IP localhost.48860 > localhost.55555: Flags [.], ack 633, win 512, options [nop,nop,TS val 537987025 ecr 537987025], length 0
15:55:38.651741 IP localhost.48860 > localhost.55555: Flags [P.], seq 44633:50212, ack 633, win 512, options [nop,nop,TS val 537987025 ecr 537987025], length 5579
15:55:38.651768 IP localhost.55555 > localhost.48860: Flags [P.], seq 633:712, ack 50212, win 124, options [nop,nop,TS val 537987025 ecr 537987025], length 79
15:55:38.651773 IP localhost.48860 > localhost.55555: Flags [.], ack 712, win 512, options [nop,nop,TS val 537987025 ecr 537987025], length 0
15:55:38.651789 IP localhost.48860 > localhost.55555: Flags [P.], seq 50212:55791, ack 712, win 512, options [nop,nop,TS val 537987025 ecr 537987025], length 5579
15:55:38.651815 IP localhost.55555 > localhost.48860: Flags [P.], seq 712:791, ack 55791, win 81, options [nop,nop,TS val 537987025 ecr 537987025], length 79
15:55:38.651821 IP localhost.48860 > localhost.55555: Flags [.], ack 791, win 512, options [nop,nop,TS val 537987025 ecr 537987025], length 0
15:55:38.651836 IP localhost.48860 > localhost.55555: Flags [P.], seq 55791:61370, ack 791, win 512, options [nop,nop,TS val 537987025 ecr 537987025], length 5579
15:55:38.651863 IP localhost.55555 > localhost.48860: Flags [P.], seq 791:870, ack 61370, win 38, options [nop,nop,TS val 537987025 ecr 537987025], length 79
15:55:38.651869 IP localhost.48860 > localhost.55555: Flags [.], ack 870, win 512, options [nop,nop,TS val 537987025 ecr 537987025], length 0
15:55:38.860661 IP localhost.48860 > localhost.55555: Flags [P.], seq 61370:66234, ack 870, win 512, options [nop,nop,TS val 537987234 ecr 537987025], length 4864
15:55:38.860672 IP localhost.55555 > localhost.48860: Flags [.], ack 66234, win 0, options [nop,nop,TS val 537987234 ecr 537987234], length 0
15:55:38.860717 IP localhost.55555 > localhost.48860: Flags [.], ack 66234, win 16, options [nop,nop,TS val 537987234 ecr 537987234], length 0
15:55:38.860723 IP localhost.48860 > localhost.55555: Flags [P.], seq 66234:66949, ack 870, win 512, options [nop,nop,TS val 537987234 ecr 537987234], length 715
15:55:38.860752 IP localhost.55555 > localhost.48860: Flags [.], ack 66949, win 16, options [nop,nop,TS val 537987234 ecr 537987234], length 0
15:55:38.860774 IP localhost.55555 > localhost.48860: Flags [P.], seq 870:949, ack 66949, win 16, options [nop,nop,TS val 537987234 ecr 537987234], length 79
15:55:38.860777 IP localhost.48860 > localhost.55555: Flags [.], ack 949, win 512, options [nop,nop,TS val 537987234 ecr 537987234], length 0
15:55:39.068658 IP localhost.48860 > localhost.55555: Flags [P.], seq 66949:68997, ack 949, win 512, options [nop,nop,TS val 537987442 ecr 537987234], length 2048
15:55:39.068675 IP localhost.55555 > localhost.48860: Flags [.], ack 68997, win 0, options [nop,nop,TS val 537987442 ecr 537987442], length 0
15:55:39.068680 IP localhost.55555 > localhost.48860: Flags [.], ack 68997, win 16, options [nop,nop,TS val 537987442 ecr 537987442], length 0
15:55:39.276641 IP localhost.48860 > localhost.55555: Flags [P.], seq 68997:71045, ack 949, win 512, options [nop,nop,TS val 537987650 ecr 537987442], length 2048
15:55:39.276652 IP localhost.55555 > localhost.48860: Flags [.], ack 71045, win 0, options [nop,nop,TS val 537987650 ecr 537987650], length 0
15:55:39.276659 IP localhost.55555 > localhost.48860: Flags [.], ack 71045, win 16, options [nop,nop,TS val 537987650 ecr 537987650], length 0
15:55:39.276666 IP localhost.48860 > localhost.55555: Flags [P.], seq 71045:72528, ack 949, win 512, options [nop,nop,TS val 537987650 ecr 537987650], length 1483
15:55:39.276698 IP localhost.55555 > localhost.48860: Flags [.], ack 72528, win 16, options [nop,nop,TS val 537987650 ecr 537987650], length 0
15:55:39.276724 IP localhost.55555 > localhost.48860: Flags [P.], seq 949:1028, ack 72528, win 16, options [nop,nop,TS val 537987650 ecr 537987650], length 79
15:55:39.276728 IP localhost.48860 > localhost.55555: Flags [.], ack 1028, win 512, options [nop,nop,TS val 537987650 ecr 537987650], length 0
15:55:39.488657 IP localhost.48860 > localhost.55555: Flags [P.], seq 72528:74576, ack 1028, win 512, options [nop,nop,TS val 537987862 ecr 537987650], length 2048
15:55:39.488667 IP localhost.55555 > localhost.48860: Flags [.], ack 74576, win 0, options [nop,nop,TS val 537987862 ecr 537987862], length 0
15:55:39.488677 IP localhost.55555 > localhost.48860: Flags [.], ack 74576, win 16, options [nop,nop,TS val 537987862 ecr 537987862], length 0
15:55:39.696639 IP localhost.48860 > localhost.55555: Flags [P.], seq 74576:76624, ack 1028, win 512, options [nop,nop,TS val 537988070 ecr 537987862], length 2048
15:55:39.696649 IP localhost.55555 > localhost.48860: Flags [.], ack 76624, win 0, options [nop,nop,TS val 537988070 ecr 537988070], length 0
15:55:39.696661 IP localhost.55555 > localhost.48860: Flags [.], ack 76624, win 16, options [nop,nop,TS val 537988070 ecr 537988070], length 0
15:55:39.696667 IP localhost.48860 > localhost.55555: Flags [P.], seq 76624:78107, ack 1028, win 512, options [nop,nop,TS val 537988070 ecr 537988070], length 1483
15:55:39.696698 IP localhost.55555 > localhost.48860: Flags [.], ack 78107, win 16, options [nop,nop,TS val 537988070 ecr 537988070], length 0
15:55:39.696714 IP localhost.55555 > localhost.48860: Flags [P.], seq 1028:1107, ack 78107, win 16, options [nop,nop,TS val 537988070 ecr 537988070], length 79
15:55:39.696718 IP localhost.48860 > localhost.55555: Flags [.], ack 1107, win 512, options [nop,nop,TS val 537988070 ecr 537988070], length 0
15:55:39.904652 IP localhost.48860 > localhost.55555: Flags [P.], seq 78107:80155, ack 1107, win 512, options [nop,nop,TS val 537988278 ecr 537988070], length 2048
15:55:39.904667 IP localhost.55555 > localhost.48860: Flags [.], ack 80155, win 16, options [nop,nop,TS val 537988278 ecr 537988278], length 0
15:55:40.112631 IP localhost.48860 > localhost.55555: Flags [P.], seq 80155:82203, ack 1107, win 512, options [nop,nop,TS val 537988486 ecr 537988278], length 2048
15:55:40.112648 IP localhost.55555 > localhost.48860: Flags [.], ack 82203, win 16, options [nop,nop,TS val 537988486 ecr 537988486], length 0
15:55:40.112656 IP localhost.48860 > localhost.55555: Flags [P.], seq 82203:83686, ack 1107, win 512, options [nop,nop,TS val 537988486 ecr 537988486], length 1483
15:55:40.112691 IP localhost.55555 > localhost.48860: Flags [.], ack 83686, win 16, options [nop,nop,TS val 537988486 ecr 537988486], length 0
15:55:40.112704 IP localhost.55555 > localhost.48860: Flags [P.], seq 1107:1186, ack 83686, win 16, options [nop,nop,TS val 537988486 ecr 537988486], length 79
15:55:40.112707 IP localhost.48860 > localhost.55555: Flags [.], ack 1186, win 512, options [nop,nop,TS val 537988486 ecr 537988486], length 0
15:55:40.324643 IP localhost.48860 > localhost.55555: Flags [P.], seq 83686:85734, ack 1186, win 512, options [nop,nop,TS val 537988698 ecr 537988486], length 2048
15:55:40.324657 IP localhost.55555 > localhost.48860: Flags [.], ack 85734, win 16, options [nop,nop,TS val 537988698 ecr 537988698], length 0
15:55:40.532641 IP localhost.48860 > localhost.55555: Flags [P.], seq 85734:87782, ack 1186, win 512, options [nop,nop,TS val 537988906 ecr 537988698], length 2048
15:55:40.532650 IP localhost.55555 > localhost.48860: Flags [.], ack 87782, win 16, options [nop,nop,TS val 537988906 ecr 537988906], length 0
15:55:40.532664 IP localhost.48860 > localhost.55555: Flags [P.], seq 87782:89265, ack 1186, win 512, options [nop,nop,TS val 537988906 ecr 537988906], length 1483
15:55:40.532698 IP localhost.55555 > localhost.48860: Flags [.], ack 89265, win 16, options [nop,nop,TS val 537988906 ecr 537988906], length 0
15:55:40.532712 IP localhost.55555 > localhost.48860: Flags [P.], seq 1186:1265, ack 89265, win 16, options [nop,nop,TS val 537988906 ecr 537988906], length 79
15:55:40.532717 IP localhost.48860 > localhost.55555: Flags [.], ack 1265, win 512, options [nop,nop,TS val 537988906 ecr 537988906], length 0
15:55:40.740659 IP localhost.48860 > localhost.55555: Flags [P.], seq 89265:91313, ack 1265, win 512, options [nop,nop,TS val 537989114 ecr 537988906], length 2048
15:55:40.740672 IP localhost.55555 > localhost.48860: Flags [.], ack 91313, win 16, options [nop,nop,TS val 537989114 ecr 537989114], length 0
15:55:40.952629 IP localhost.48860 > localhost.55555: Flags [P.], seq 91313:93361, ack 1265, win 512, options [nop,nop,TS val 537989326 ecr 537989114], length 2048
15:55:40.952651 IP localhost.55555 > localhost.48860: Flags [.], ack 93361, win 16, options [nop,nop,TS val 537989326 ecr 537989326], length 0
15:55:40.952657 IP localhost.48860 > localhost.55555: Flags [P.], seq 93361:94844, ack 1265, win 512, options [nop,nop,TS val 537989326 ecr 537989326], length 1483
15:55:40.952691 IP localhost.55555 > localhost.48860: Flags [.], ack 94844, win 16, options [nop,nop,TS val 537989326 ecr 537989326], length 0
15:55:40.952706 IP localhost.55555 > localhost.48860: Flags [P.], seq 1265:1344, ack 94844, win 16, options [nop,nop,TS val 537989326 ecr 537989326], length 79
15:55:40.952717 IP localhost.48860 > localhost.55555: Flags [.], ack 1344, win 512, options [nop,nop,TS val 537989326 ecr 537989326], length 0
15:55:41.164650 IP localhost.48860 > localhost.55555: Flags [P.], seq 94844:96892, ack 1344, win 512, options [nop,nop,TS val 537989538 ecr 537989326], length 2048
15:55:41.164662 IP localhost.55555 > localhost.48860: Flags [.], ack 96892, win 16, options [nop,nop,TS val 537989538 ecr 537989538], length 0
15:55:41.372651 IP localhost.48860 > localhost.55555: Flags [P.], seq 96892:98940, ack 1344, win 512, options [nop,nop,TS val 537989746 ecr 537989538], length 2048
15:55:41.372662 IP localhost.55555 > localhost.48860: Flags [.], ack 98940, win 16, options [nop,nop,TS val 537989746 ecr 537989746], length 0
15:55:41.372670 IP localhost.48860 > localhost.55555: Flags [P.], seq 98940:100423, ack 1344, win 512, options [nop,nop,TS val 537989746 ecr 537989746], length 1483
15:55:41.372696 IP localhost.55555 > localhost.48860: Flags [.], ack 100423, win 16, options [nop,nop,TS val 537989746 ecr 537989746], length 0
15:55:41.372718 IP localhost.55555 > localhost.48860: Flags [P.], seq 1344:1423, ack 100423, win 16, options [nop,nop,TS val 537989746 ecr 537989746], length 79
15:55:41.372722 IP localhost.48860 > localhost.55555: Flags [.], ack 1423, win 512, options [nop,nop,TS val 537989746 ecr 537989746], length 0
15:55:41.584638 IP localhost.48860 > localhost.55555: Flags [P.], seq 100423:102471, ack 1423, win 512, options [nop,nop,TS val 537989958 ecr 537989746], length 2048
15:55:41.584651 IP localhost.55555 > localhost.48860: Flags [.], ack 102471, win 16, options [nop,nop,TS val 537989958 ecr 537989958], length 0
15:55:41.792649 IP localhost.48860 > localhost.55555: Flags [P.], seq 102471:104519, ack 1423, win 512, options [nop,nop,TS val 537990166 ecr 537989958], length 2048
15:55:41.792669 IP localhost.55555 > localhost.48860: Flags [.], ack 104519, win 16, options [nop,nop,TS val 537990166 ecr 537990166], length 0
15:55:41.792677 IP localhost.48860 > localhost.55555: Flags [P.], seq 104519:106002, ack 1423, win 512, options [nop,nop,TS val 537990166 ecr 537990166], length 1483
15:55:41.792710 IP localhost.55555 > localhost.48860: Flags [.], ack 106002, win 16, options [nop,nop,TS val 537990166 ecr 537990166], length 0
15:55:41.792725 IP localhost.55555 > localhost.48860: Flags [P.], seq 1423:1502, ack 106002, win 16, options [nop,nop,TS val 537990166 ecr 537990166], length 79
15:55:41.792728 IP localhost.48860 > localhost.55555: Flags [.], ack 1502, win 512, options [nop,nop,TS val 537990166 ecr 537990166], length 0
15:55:42.004661 IP localhost.48860 > localhost.55555: Flags [P.], seq 106002:108050, ack 1502, win 512, options [nop,nop,TS val 537990378 ecr 537990166], length 2048
15:55:42.004674 IP localhost.55555 > localhost.48860: Flags [.], ack 108050, win 16, options [nop,nop,TS val 537990378 ecr 537990378], length 0
15:55:42.212642 IP localhost.48860 > localhost.55555: Flags [P.], seq 108050:110098, ack 1502, win 512, options [nop,nop,TS val 537990586 ecr 537990378], length 2048
15:55:42.212661 IP localhost.55555 > localhost.48860: Flags [.], ack 110098, win 16, options [nop,nop,TS val 537990586 ecr 537990586], length 0
15:55:42.212669 IP localhost.48860 > localhost.55555: Flags [P.], seq 110098:111581, ack 1502, win 512, options [nop,nop,TS val 537990586 ecr 537990586], length 1483
15:55:42.212701 IP localhost.55555 > localhost.48860: Flags [.], ack 111581, win 16, options [nop,nop,TS val 537990586 ecr 537990586], length 0
15:55:42.212723 IP localhost.55555 > localhost.48860: Flags [P.], seq 1502:1581, ack 111581, win 16, options [nop,nop,TS val 537990586 ecr 537990586], length 79
15:55:42.212727 IP localhost.48860 > localhost.55555: Flags [.], ack 1581, win 512, options [nop,nop,TS val 537990586 ecr 537990586], length 0
15:55:42.420639 IP localhost.48860 > localhost.55555: Flags [P.], seq 111581:113629, ack 1581, win 512, options [nop,nop,TS val 537990794 ecr 537990586], length 2048
15:55:42.420661 IP localhost.55555 > localhost.48860: Flags [.], ack 113629, win 16, options [nop,nop,TS val 537990794 ecr 537990794], length 0
15:55:42.628646 IP localhost.48860 > localhost.55555: Flags [P.], seq 113629:115677, ack 1581, win 512, options [nop,nop,TS val 537991002 ecr 537990794], length 2048
15:55:42.628665 IP localhost.55555 > localhost.48860: Flags [.], ack 115677, win 16, options [nop,nop,TS val 537991002 ecr 537991002], length 0
15:55:42.628673 IP localhost.48860 > localhost.55555: Flags [P.], seq 115677:117160, ack 1581, win 512, options [nop,nop,TS val 537991002 ecr 537991002], length 1483
15:55:42.628710 IP localhost.55555 > localhost.48860: Flags [.], ack 117160, win 16, options [nop,nop,TS val 537991002 ecr 537991002], length 0
15:55:42.628725 IP localhost.55555 > localhost.48860: Flags [P.], seq 1581:1660, ack 117160, win 16, options [nop,nop,TS val 537991002 ecr 537991002], length 79
15:55:42.628729 IP localhost.48860 > localhost.55555: Flags [.], ack 1660, win 512, options [nop,nop,TS val 537991002 ecr 537991002], length 0
15:55:42.836636 IP localhost.48860 > localhost.55555: Flags [P.], seq 117160:119208, ack 1660, win 512, options [nop,nop,TS val 537991210 ecr 537991002], length 2048
15:55:42.836643 IP localhost.55555 > localhost.48860: Flags [.], ack 119208, win 16, options [nop,nop,TS val 537991210 ecr 537991210], length 0
15:55:43.048642 IP localhost.48860 > localhost.55555: Flags [P.], seq 119208:121256, ack 1660, win 512, options [nop,nop,TS val 537991422 ecr 537991210], length 2048
15:55:43.048660 IP localhost.55555 > localhost.48860: Flags [.], ack 121256, win 16, options [nop,nop,TS val 537991422 ecr 537991422], length 0
15:55:43.048668 IP localhost.48860 > localhost.55555: Flags [P.], seq 121256:122739, ack 1660, win 512, options [nop,nop,TS val 537991422 ecr 537991422], length 1483
15:55:43.048703 IP localhost.55555 > localhost.48860: Flags [.], ack 122739, win 16, options [nop,nop,TS val 537991422 ecr 537991422], length 0
15:55:43.048721 IP localhost.55555 > localhost.48860: Flags [P.], seq 1660:1739, ack 122739, win 16, options [nop,nop,TS val 537991422 ecr 537991422], length 79
15:55:43.048724 IP localhost.48860 > localhost.55555: Flags [.], ack 1739, win 512, options [nop,nop,TS val 537991422 ecr 537991422], length 0
15:55:43.256654 IP localhost.48860 > localhost.55555: Flags [P.], seq 122739:124787, ack 1739, win 512, options [nop,nop,TS val 537991630 ecr 537991422], length 2048
15:55:43.256666 IP localhost.55555 > localhost.48860: Flags [.], ack 124787, win 16, options [nop,nop,TS val 537991630 ecr 537991630], length 0
15:55:43.468642 IP localhost.48860 > localhost.55555: Flags [P.], seq 124787:126835, ack 1739, win 512, options [nop,nop,TS val 537991842 ecr 537991630], length 2048
15:55:43.468654 IP localhost.55555 > localhost.48860: Flags [.], ack 126835, win 16, options [nop,nop,TS val 537991842 ecr 537991842], length 0
15:55:43.468661 IP localhost.48860 > localhost.55555: Flags [P.], seq 126835:128318, ack 1739, win 512, options [nop,nop,TS val 537991842 ecr 537991842], length 1483
15:55:43.468695 IP localhost.55555 > localhost.48860: Flags [.], ack 128318, win 16, options [nop,nop,TS val 537991842 ecr 537991842], length 0
15:55:43.468709 IP localhost.55555 > localhost.48860: Flags [P.], seq 1739:1818, ack 128318, win 16, options [nop,nop,TS val 537991842 ecr 537991842], length 79
15:55:43.468713 IP localhost.48860 > localhost.55555: Flags [.], ack 1818, win 512, options [nop,nop,TS val 537991842 ecr 537991842], length 0
15:55:43.676635 IP localhost.48860 > localhost.55555: Flags [P.], seq 128318:130366, ack 1818, win 512, options [nop,nop,TS val 537992050 ecr 537991842], length 2048
15:55:43.676654 IP localhost.55555 > localhost.48860: Flags [.], ack 130366, win 16, options [nop,nop,TS val 537992050 ecr 537992050], length 0
15:55:43.888633 IP localhost.48860 > localhost.55555: Flags [P.], seq 130366:132414, ack 1818, win 512, options [nop,nop,TS val 537992262 ecr 537992050], length 2048
15:55:43.888639 IP localhost.55555 > localhost.48860: Flags [.], ack 132414, win 16, options [nop,nop,TS val 537992262 ecr 537992262], length 0
15:55:43.888645 IP localhost.48860 > localhost.55555: Flags [P.], seq 132414:133897, ack 1818, win 512, options [nop,nop,TS val 537992262 ecr 537992262], length 1483
15:55:43.888664 IP localhost.55555 > localhost.48860: Flags [.], ack 133897, win 16, options [nop,nop,TS val 537992262 ecr 537992262], length 0
15:55:43.888684 IP localhost.55555 > localhost.48860: Flags [P.], seq 1818:1897, ack 133897, win 16, options [nop,nop,TS val 537992262 ecr 537992262], length 79
15:55:43.888688 IP localhost.48860 > localhost.55555: Flags [.], ack 1897, win 512, options [nop,nop,TS val 537992262 ecr 537992262], length 0
15:55:44.096645 IP localhost.48860 > localhost.55555: Flags [P.], seq 133897:135945, ack 1897, win 512, options [nop,nop,TS val 537992470 ecr 537992262], length 2048
15:55:44.096658 IP localhost.55555 > localhost.48860: Flags [.], ack 135945, win 16, options [nop,nop,TS val 537992470 ecr 537992470], length 0
15:55:44.308638 IP localhost.48860 > localhost.55555: Flags [P.], seq 135945:137993, ack 1897, win 512, options [nop,nop,TS val 537992682 ecr 537992470], length 2048
15:55:44.308649 IP localhost.55555 > localhost.48860: Flags [.], ack 137993, win 16, options [nop,nop,TS val 537992682 ecr 537992682], length 0
15:55:44.308663 IP localhost.48860 > localhost.55555: Flags [P.], seq 137993:139476, ack 1897, win 512, options [nop,nop,TS val 537992682 ecr 537992682], length 1483
15:55:44.308693 IP localhost.55555 > localhost.48860: Flags [.], ack 139476, win 16, options [nop,nop,TS val 537992682 ecr 537992682], length 0
15:55:44.308707 IP localhost.55555 > localhost.48860: Flags [P.], seq 1897:1976, ack 139476, win 16, options [nop,nop,TS val 537992682 ecr 537992682], length 79
15:55:44.308711 IP localhost.48860 > localhost.55555: Flags [.], ack 1976, win 512, options [nop,nop,TS val 537992682 ecr 537992682], length 0
15:55:44.520650 IP localhost.48860 > localhost.55555: Flags [P.], seq 139476:141524, ack 1976, win 512, options [nop,nop,TS val 537992894 ecr 537992682], length 2048
15:55:44.520672 IP localhost.55555 > localhost.48860: Flags [.], ack 141524, win 16, options [nop,nop,TS val 537992894 ecr 537992894], length 0
15:55:44.732639 IP localhost.48860 > localhost.55555: Flags [P.], seq 141524:143572, ack 1976, win 512, options [nop,nop,TS val 537993106 ecr 537992894], length 2048
15:55:44.732658 IP localhost.55555 > localhost.48860: Flags [.], ack 143572, win 16, options [nop,nop,TS val 537993106 ecr 537993106], length 0
15:55:44.732666 IP localhost.48860 > localhost.55555: Flags [P.], seq 143572:145055, ack 1976, win 512, options [nop,nop,TS val 537993106 ecr 537993106], length 1483
15:55:44.732695 IP localhost.55555 > localhost.48860: Flags [.], ack 145055, win 16, options [nop,nop,TS val 537993106 ecr 537993106], length 0
15:55:44.732709 IP localhost.55555 > localhost.48860: Flags [P.], seq 1976:2055, ack 145055, win 16, options [nop,nop,TS val 537993106 ecr 537993106], length 79
15:55:44.732713 IP localhost.48860 > localhost.55555: Flags [.], ack 2055, win 512, options [nop,nop,TS val 537993106 ecr 537993106], length 0
15:55:44.940640 IP localhost.48860 > localhost.55555: Flags [P.], seq 145055:147103, ack 2055, win 512, options [nop,nop,TS val 537993314 ecr 537993106], length 2048
15:55:44.940666 IP localhost.55555 > localhost.48860: Flags [.], ack 147103, win 16, options [nop,nop,TS val 537993314 ecr 537993314], length 0
15:55:45.148636 IP localhost.48860 > localhost.55555: Flags [P.], seq 147103:149151, ack 2055, win 512, options [nop,nop,TS val 537993522 ecr 537993314], length 2048
15:55:45.148645 IP localhost.55555 > localhost.48860: Flags [.], ack 149151, win 16, options [nop,nop,TS val 537993522 ecr 537993522], length 0
15:55:45.148653 IP localhost.48860 > localhost.55555: Flags [P.], seq 149151:150634, ack 2055, win 512, options [nop,nop,TS val 537993522 ecr 537993522], length 1483
15:55:45.148681 IP localhost.55555 > localhost.48860: Flags [.], ack 150634, win 16, options [nop,nop,TS val 537993522 ecr 537993522], length 0
15:55:45.148695 IP localhost.55555 > localhost.48860: Flags [P.], seq 2055:2134, ack 150634, win 16, options [nop,nop,TS val 537993522 ecr 537993522], length 79
15:55:45.148699 IP localhost.48860 > localhost.55555: Flags [.], ack 2134, win 512, options [nop,nop,TS val 537993522 ecr 537993522], length 0
15:55:45.356635 IP localhost.48860 > localhost.55555: Flags [P.], seq 150634:152682, ack 2134, win 512, options [nop,nop,TS val 537993730 ecr 537993522], length 2048
15:55:45.356647 IP localhost.55555 > localhost.48860: Flags [.], ack 152682, win 16, options [nop,nop,TS val 537993730 ecr 537993730], length 0
15:55:45.564639 IP localhost.48860 > localhost.55555: Flags [P.], seq 152682:154730, ack 2134, win 512, options [nop,nop,TS val 537993938 ecr 537993730], length 2048
15:55:45.564651 IP localhost.55555 > localhost.48860: Flags [.], ack 154730, win 16, options [nop,nop,TS val 537993938 ecr 537993938], length 0
15:55:45.564658 IP localhost.48860 > localhost.55555: Flags [P.], seq 154730:156213, ack 2134, win 512, options [nop,nop,TS val 537993938 ecr 537993938], length 1483
15:55:45.564684 IP localhost.55555 > localhost.48860: Flags [.], ack 156213, win 16, options [nop,nop,TS val 537993938 ecr 537993938], length 0
15:55:45.564699 IP localhost.55555 > localhost.48860: Flags [P.], seq 2134:2213, ack 156213, win 16, options [nop,nop,TS val 537993938 ecr 537993938], length 79
15:55:45.564702 IP localhost.48860 > localhost.55555: Flags [.], ack 2213, win 512, options [nop,nop,TS val 537993938 ecr 537993938], length 0
15:55:45.776634 IP localhost.48860 > localhost.55555: Flags [P.], seq 156213:158261, ack 2213, win 512, options [nop,nop,TS val 537994150 ecr 537993938], length 2048
15:55:45.776644 IP localhost.55555 > localhost.48860: Flags [.], ack 158261, win 16, options [nop,nop,TS val 537994150 ecr 537994150], length 0
15:55:45.984640 IP localhost.48860 > localhost.55555: Flags [P.], seq 158261:160309, ack 2213, win 512, options [nop,nop,TS val 537994358 ecr 537994150], length 2048
15:55:45.984648 IP localhost.55555 > localhost.48860: Flags [.], ack 160309, win 16, options [nop,nop,TS val 537994358 ecr 537994358], length 0
15:55:45.984656 IP localhost.48860 > localhost.55555: Flags [P.], seq 160309:161792, ack 2213, win 512, options [nop,nop,TS val 537994358 ecr 537994358], length 1483
15:55:45.984692 IP localhost.55555 > localhost.48860: Flags [.], ack 161792, win 16, options [nop,nop,TS val 537994358 ecr 537994358], length 0
15:55:45.984705 IP localhost.55555 > localhost.48860: Flags [P.], seq 2213:2292, ack 161792, win 16, options [nop,nop,TS val 537994358 ecr 537994358], length 79
15:55:45.984709 IP localhost.48860 > localhost.55555: Flags [.], ack 2292, win 512, options [nop,nop,TS val 537994358 ecr 537994358], length 0
15:55:46.196650 IP localhost.48860 > localhost.55555: Flags [P.], seq 161792:163840, ack 2292, win 512, options [nop,nop,TS val 537994570 ecr 537994358], length 2048
15:55:46.196669 IP localhost.55555 > localhost.48860: Flags [.], ack 163840, win 16, options [nop,nop,TS val 537994570 ecr 537994570], length 0
15:55:46.408645 IP localhost.48860 > localhost.55555: Flags [P.], seq 163840:165888, ack 2292, win 512, options [nop,nop,TS val 537994782 ecr 537994570], length 2048
15:55:46.408657 IP localhost.55555 > localhost.48860: Flags [.], ack 165888, win 16, options [nop,nop,TS val 537994782 ecr 537994782], length 0
15:55:46.408666 IP localhost.48860 > localhost.55555: Flags [P.], seq 165888:167371, ack 2292, win 512, options [nop,nop,TS val 537994782 ecr 537994782], length 1483
15:55:46.408700 IP localhost.55555 > localhost.48860: Flags [.], ack 167371, win 16, options [nop,nop,TS val 537994782 ecr 537994782], length 0
15:55:46.408721 IP localhost.55555 > localhost.48860: Flags [P.], seq 2292:2371, ack 167371, win 16, options [nop,nop,TS val 537994782 ecr 537994782], length 79
15:55:46.408725 IP localhost.48860 > localhost.55555: Flags [.], ack 2371, win 512, options [nop,nop,TS val 537994782 ecr 537994782], length 0
15:55:46.616646 IP localhost.48860 > localhost.55555: Flags [P.], seq 167371:169419, ack 2371, win 512, options [nop,nop,TS val 537994990 ecr 537994782], length 2048
15:55:46.616659 IP localhost.55555 > localhost.48860: Flags [.], ack 169419, win 16, options [nop,nop,TS val 537994990 ecr 537994990], length 0
15:55:46.828635 IP localhost.48860 > localhost.55555: Flags [P.], seq 169419:171467, ack 2371, win 512, options [nop,nop,TS val 537995202 ecr 537994990], length 2048
15:55:46.828644 IP localhost.55555 > localhost.48860: Flags [.], ack 171467, win 16, options [nop,nop,TS val 537995202 ecr 537995202], length 0
15:55:46.828650 IP localhost.48860 > localhost.55555: Flags [P.], seq 171467:172950, ack 2371, win 512, options [nop,nop,TS val 537995202 ecr 537995202], length 1483
15:55:46.828673 IP localhost.55555 > localhost.48860: Flags [.], ack 172950, win 16, options [nop,nop,TS val 537995202 ecr 537995202], length 0
15:55:46.828687 IP localhost.55555 > localhost.48860: Flags [P.], seq 2371:2450, ack 172950, win 16, options [nop,nop,TS val 537995202 ecr 537995202], length 79
15:55:46.828691 IP localhost.48860 > localhost.55555: Flags [.], ack 2450, win 512, options [nop,nop,TS val 537995202 ecr 537995202], length 0
15:55:47.036643 IP localhost.48860 > localhost.55555: Flags [P.], seq 172950:174998, ack 2450, win 512, options [nop,nop,TS val 537995410 ecr 537995202], length 2048
15:55:47.036664 IP localhost.55555 > localhost.48860: Flags [.], ack 174998, win 16, options [nop,nop,TS val 537995410 ecr 537995410], length 0
15:55:47.244648 IP localhost.48860 > localhost.55555: Flags [P.], seq 174998:177046, ack 2450, win 512, options [nop,nop,TS val 537995618 ecr 537995410], length 2048
15:55:47.244662 IP localhost.55555 > localhost.48860: Flags [.], ack 177046, win 16, options [nop,nop,TS val 537995618 ecr 537995618], length 0
15:55:47.244671 IP localhost.48860 > localhost.55555: Flags [P.], seq 177046:178529, ack 2450, win 512, options [nop,nop,TS val 537995618 ecr 537995618], length 1483
15:55:47.244712 IP localhost.55555 > localhost.48860: Flags [.], ack 178529, win 16, options [nop,nop,TS val 537995618 ecr 537995618], length 0
15:55:47.244729 IP localhost.55555 > localhost.48860: Flags [P.], seq 2450:2529, ack 178529, win 16, options [nop,nop,TS val 537995618 ecr 537995618], length 79
15:55:47.244733 IP localhost.48860 > localhost.55555: Flags [.], ack 2529, win 512, options [nop,nop,TS val 537995618 ecr 537995618], length 0
15:55:47.452645 IP localhost.48860 > localhost.55555: Flags [P.], seq 178529:180577, ack 2529, win 512, options [nop,nop,TS val 537995826 ecr 537995618], length 2048
15:55:47.452665 IP localhost.55555 > localhost.48860: Flags [.], ack 180577, win 16, options [nop,nop,TS val 537995826 ecr 537995826], length 0
15:55:47.660647 IP localhost.48860 > localhost.55555: Flags [P.], seq 180577:182625, ack 2529, win 512, options [nop,nop,TS val 537996034 ecr 537995826], length 2048
15:55:47.660660 IP localhost.55555 > localhost.48860: Flags [.], ack 182625, win 16, options [nop,nop,TS val 537996034 ecr 537996034], length 0
15:55:47.660668 IP localhost.48860 > localhost.55555: Flags [P.], seq 182625:184108, ack 2529, win 512, options [nop,nop,TS val 537996034 ecr 537996034], length 1483
15:55:47.660701 IP localhost.55555 > localhost.48860: Flags [.], ack 184108, win 16, options [nop,nop,TS val 537996034 ecr 537996034], length 0
15:55:47.660717 IP localhost.55555 > localhost.48860: Flags [P.], seq 2529:2608, ack 184108, win 16, options [nop,nop,TS val 537996034 ecr 537996034], length 79
15:55:47.660721 IP localhost.48860 > localhost.55555: Flags [.], ack 2608, win 512, options [nop,nop,TS val 537996034 ecr 537996034], length 0
15:55:47.868653 IP localhost.48860 > localhost.55555: Flags [P.], seq 184108:186156, ack 2608, win 512, options [nop,nop,TS val 537996242 ecr 537996034], length 2048
15:55:47.868676 IP localhost.55555 > localhost.48860: Flags [.], ack 186156, win 16, options [nop,nop,TS val 537996242 ecr 537996242], length 0
15:55:48.076653 IP localhost.48860 > localhost.55555: Flags [P.], seq 186156:188204, ack 2608, win 512, options [nop,nop,TS val 537996450 ecr 537996242], length 2048
15:55:48.076673 IP localhost.55555 > localhost.48860: Flags [.], ack 188204, win 16, options [nop,nop,TS val 537996450 ecr 537996450], length 0
15:55:48.076681 IP localhost.48860 > localhost.55555: Flags [P.], seq 188204:189687, ack 2608, win 512, options [nop,nop,TS val 537996450 ecr 537996450], length 1483
15:55:48.076719 IP localhost.55555 > localhost.48860: Flags [.], ack 189687, win 16, options [nop,nop,TS val 537996450 ecr 537996450], length 0
15:55:48.076734 IP localhost.55555 > localhost.48860: Flags [P.], seq 2608:2687, ack 189687, win 16, options [nop,nop,TS val 537996450 ecr 537996450], length 79
15:55:48.076737 IP localhost.48860 > localhost.55555: Flags [.], ack 2687, win 512, options [nop,nop,TS val 537996450 ecr 537996450], length 0
15:55:48.284640 IP localhost.48860 > localhost.55555: Flags [P.], seq 189687:191735, ack 2687, win 512, options [nop,nop,TS val 537996658 ecr 537996450], length 2048
15:55:48.284662 IP localhost.55555 > localhost.48860: Flags [.], ack 191735, win 16, options [nop,nop,TS val 537996658 ecr 537996658], length 0
15:55:48.496645 IP localhost.48860 > localhost.55555: Flags [P.], seq 191735:193783, ack 2687, win 512, options [nop,nop,TS val 537996870 ecr 537996658], length 2048
15:55:48.496657 IP localhost.55555 > localhost.48860: Flags [.], ack 193783, win 16, options [nop,nop,TS val 537996870 ecr 537996870], length 0
15:55:48.496666 IP localhost.48860 > localhost.55555: Flags [P.], seq 193783:195266, ack 2687, win 512, options [nop,nop,TS val 537996870 ecr 537996870], length 1483
15:55:48.496696 IP localhost.55555 > localhost.48860: Flags [.], ack 195266, win 16, options [nop,nop,TS val 537996870 ecr 537996870], length 0
15:55:48.496712 IP localhost.55555 > localhost.48860: Flags [P.], seq 2687:2766, ack 195266, win 16, options [nop,nop,TS val 537996870 ecr 537996870], length 79
15:55:48.496716 IP localhost.48860 > localhost.55555: Flags [.], ack 2766, win 512, options [nop,nop,TS val 537996870 ecr 537996870], length 0
15:55:48.708644 IP localhost.48860 > localhost.55555: Flags [P.], seq 195266:197314, ack 2766, win 512, options [nop,nop,TS val 537997082 ecr 537996870], length 2048
15:55:48.708665 IP localhost.55555 > localhost.48860: Flags [.], ack 197314, win 16, options [nop,nop,TS val 537997082 ecr 537997082], length 0
15:55:48.916649 IP localhost.48860 > localhost.55555: Flags [P.], seq 197314:199362, ack 2766, win 512, options [nop,nop,TS val 537997290 ecr 537997082], length 2048
15:55:48.916661 IP localhost.55555 > localhost.48860: Flags [.], ack 199362, win 16, options [nop,nop,TS val 537997290 ecr 537997290], length 0
15:55:48.916669 IP localhost.48860 > localhost.55555: Flags [P.], seq 199362:200845, ack 2766, win 512, options [nop,nop,TS val 537997290 ecr 537997290], length 1483
15:55:48.916701 IP localhost.55555 > localhost.48860: Flags [.], ack 200845, win 16, options [nop,nop,TS val 537997290 ecr 537997290], length 0
15:55:48.916723 IP localhost.55555 > localhost.48860: Flags [P.], seq 2766:2845, ack 200845, win 16, options [nop,nop,TS val 537997290 ecr 537997290], length 79
15:55:48.916727 IP localhost.48860 > localhost.55555: Flags [.], ack 2845, win 512, options [nop,nop,TS val 537997290 ecr 537997290], length 0
15:55:49.128650 IP localhost.48860 > localhost.55555: Flags [P.], seq 200845:202893, ack 2845, win 512, options [nop,nop,TS val 537997502 ecr 537997290], length 2048
15:55:49.128663 IP localhost.55555 > localhost.48860: Flags [.], ack 202893, win 16, options [nop,nop,TS val 537997502 ecr 537997502], length 0
15:55:49.336646 IP localhost.48860 > localhost.55555: Flags [P.], seq 202893:204941, ack 2845, win 512, options [nop,nop,TS val 537997710 ecr 537997502], length 2048
15:55:49.336665 IP localhost.55555 > localhost.48860: Flags [.], ack 204941, win 16, options [nop,nop,TS val 537997710 ecr 537997710], length 0
15:55:49.336673 IP localhost.48860 > localhost.55555: Flags [P.], seq 204941:206424, ack 2845, win 512, options [nop,nop,TS val 537997710 ecr 537997710], length 1483
15:55:49.336703 IP localhost.55555 > localhost.48860: Flags [.], ack 206424, win 16, options [nop,nop,TS val 537997710 ecr 537997710], length 0
15:55:49.336725 IP localhost.55555 > localhost.48860: Flags [P.], seq 2845:2924, ack 206424, win 16, options [nop,nop,TS val 537997710 ecr 537997710], length 79
15:55:49.336729 IP localhost.48860 > localhost.55555: Flags [.], ack 2924, win 512, options [nop,nop,TS val 537997710 ecr 537997710], length 0
15:55:49.544638 IP localhost.48860 > localhost.55555: Flags [P.], seq 206424:208472, ack 2924, win 512, options [nop,nop,TS val 537997918 ecr 537997710], length 2048
15:55:49.544649 IP localhost.55555 > localhost.48860: Flags [.], ack 208472, win 16, options [nop,nop,TS val 537997918 ecr 537997918], length 0
15:55:49.756653 IP localhost.48860 > localhost.55555: Flags [P.], seq 208472:210520, ack 2924, win 512, options [nop,nop,TS val 537998130 ecr 537997918], length 2048
15:55:49.756664 IP localhost.55555 > localhost.48860: Flags [.], ack 210520, win 16, options [nop,nop,TS val 537998130 ecr 537998130], length 0
15:55:49.756671 IP localhost.48860 > localhost.55555: Flags [P.], seq 210520:212003, ack 2924, win 512, options [nop,nop,TS val 537998130 ecr 537998130], length 1483
15:55:49.756693 IP localhost.55555 > localhost.48860: Flags [.], ack 212003, win 16, options [nop,nop,TS val 537998130 ecr 537998130], length 0
15:55:49.756707 IP localhost.55555 > localhost.48860: Flags [P.], seq 2924:3003, ack 212003, win 16, options [nop,nop,TS val 537998130 ecr 537998130], length 79
15:55:49.756710 IP localhost.48860 > localhost.55555: Flags [.], ack 3003, win 512, options [nop,nop,TS val 537998130 ecr 537998130], length 0
15:55:49.964657 IP localhost.48860 > localhost.55555: Flags [P.], seq 212003:214051, ack 3003, win 512, options [nop,nop,TS val 537998338 ecr 537998130], length 2048
15:55:49.964681 IP localhost.55555 > localhost.48860: Flags [.], ack 214051, win 16, options [nop,nop,TS val 537998338 ecr 537998338], length 0
15:55:50.172650 IP localhost.48860 > localhost.55555: Flags [P.], seq 214051:216099, ack 3003, win 512, options [nop,nop,TS val 537998546 ecr 537998338], length 2048
15:55:50.172677 IP localhost.55555 > localhost.48860: Flags [.], ack 216099, win 16, options [nop,nop,TS val 537998546 ecr 537998546], length 0
